posted,Experience,location,jobType,Education,description,name,title,feed
Posted 30+ days ago,4 - 6 Years,Riyadh,,Any Graduation(),"Job DescriptionRoles & ResponsibilitiesJob DescriptionDenodo is looking for a passionate thought-leader and hands-on data advocate to join our Enterprise Data Strategy team. As a seasoned professional, you will guide our clients data and analytics journey.In this role you will combine strategy, technology, and client relationship expertise in short-term engagements with Denodo s customers. Your mission: enable customers to realize the full potential of their data by setting the foundation of their data virtualization program, establishing the frameworks to mature their organizations and deployments to an enterprise level.Job Responsibilities & DutiesData and Analytics Strategy• Play a key consultative role in the development of data strategies for various customers to help shape the future of what their data-centric organizations look like.• Focus on helping business organizations achieve transformational change through designing, developing, and advising on enterprise data strategy programs and related work streams.• Support customers to define the processes, mindsets, technologies, and expertise required to convert data to action and derive value from its use.Architecture and Solution Advisory• Engage with customers in architectural discussions that will define the role of data virtualization in their organization and its integration with other parts of the data ecosystem.• Provide functional and technical architecture guidelines to bridge the clients business needs with their infrastructure and operational constraints.• Help customers define the duties, responsibilities and teams to manage and operate the Denodo deployment.• Adapt Denodo s best practices to the needs of the customer to simplify the adoption of the data virtualization technology.• Address the customer questions concerning customization, integration, enterprise architecture and general functionality of Denodo s product.• Promote the value proposition of data virtualization to other teams within the customer organization.Customer Management• Provide timely, prioritized and complete customer-based feedback to Product Management, Sales and Services regarding the customer business cases, requirements and issues.• Manage client expectations, establish credibility at all levels within the customer and build problem-solving partnerships with the client, partners and colleagues.• Advise the clients on additional resource and staff needs.• Know when and where to escalate within the Denodo technical organization, and make effective use of those resources.• Identify extension opportunities and new usage benefits of Denodo at the clients.Presentation and Content Creation• Develop white papers, presentations, training materials or documentation on related topics.• Deliver actionable documentation for each customer engagement.Desired Skills & Experience• University Degree in information systems or computer science (Bachelor or Masters).• 4+ years of demonstrated experience in a similar role.• Excellent verbal and written communication skills to be able to interact with technical and business counterparts.• 8+ years of experience in customer facing positions.• Excellent verbal and written communication skills in English and Arabic is required.• Demonstrated experience with forming and implementing data strategy, management, governance, and architecture.• Proven track record of helping business customers/clients establish next generation data products and processes.• Be well versed in the ingestion, transformation, movement, sharing, stewardship, and quality of data and information.• Deep knowledge of technologies and markets that support data integration and analytics such as Data Warehousing, Business Intelligence, Data Science, etc.• Willingness to travel around 40% of the time.We value:• Experience working with Big Data and noSQL architecture.• Good understanding of Internet of Things and Streaming technologies.• Experience in web technologies, architectures and services (AWS, Azure, Docker, etc.).• Knowledge of AI and Machine Learning software and techniques.• Knowledge about architectural frameworks (TOGAF / EAP / Zachman).",Denodo Technologies,Solution Consultant,https://www.naukrigulf.com/solution-consultant-jobs-in-riyadh-saudi-arabia-in-denodo-technologies-4-to-6-years-n-cd-10001339-jid-240524500246
Posted 30+ days ago,2 - 6 Years,Saudi Arabia,,Any Graduation(),"Job DescriptionRoles & ResponsibilitiesCompany Description""Why work for Accor?We are far more than a worldwide leader. We welcome you as you are and you can find a job and brand that matches your personality. We support you to grow and learn every day, making sure that work brings purpose to your life, so that during your journey with us, you can continue to explore Accor s limitless possibilities.By joining Accor, every chapter of your story is yours to write and together we can imagine tomorrow's hospitality. Discover the life that awaits you at Accor, visit https://careers.accor.com/Do what you love, care for the world, dare to challenge the status quo! #BELIMITLESS""Job DescriptionSales and Marketing ManagerThrough your passion and motivation, you sell memorable experience to guests who stay in your property. You are professional and knowledgeable about your property, and you build strong relationships and create bond with your guests.What s in it for you:In 3-4 bullet points, showcase the benefits and perks of working at the propertyEmployee benefit card offering discounted rates in Accor worldwideLearning programs through our AcademiesOpportunity to develop your talent and grow within your property and across the world!Ability to make a difference through our Corporate Social Responsibility activities, like Planet 21What you will be doing:Solicit group, transient and/or banquet business, and reach consistent achievement of sales objectivesEstablish parameters, quotes and negotiate prices and seal contractsParticipate in tradeshows, conventions and promotional eventsMaintain accounts, contact, activity and business details• Guest Centric•   Conduct daily briefing with department on current key activities   Direct and manage all group, transient, and catering/banquet sales activities to maximize revenue for the hotel   Survey, review and analyze competition, market trends, customer needs and comments in order to be proactive and adapt with business intelligence   Determine the effectiveness of existing programs and develop new strategies   Manage/direct all advertising, public relations and promotional activities in conjunction with corporate marketing and public relations department.   Actively participates in sales presentations, property tours and customer meetings   Evaluate changes in guest needs, the guest mix and competitive set, to recommend appropriate product/service and operational changes as necessaryQualificationsYour experience and skills include:Relevant sales experience is an assetAbility to focus attention on guest needs, remaining calm and courteous at all timesHighly responsible & reliableExcellent communication skills, both written and verbal requiredStrong interpersonal and problem solving abilities",Accor,Sales and Marketing Manager,https://www.naukrigulf.com/sales-and-marketing-manager-jobs-in-saudi-arabia-in-accor-2-to-6-years-n-cd-10003274-jid-220524501842
Posted 30+ days ago,3 - 6 Years,Jeddah,,"Bachelor of Technology/Engineering(), Bachelor of Science(Computers)","Job DescriptionRoles & Responsibilities This role is responsible of maintaining and managing database objects across entire organization and experience in data engineering with an emphasis on data analytics and reporting.KEY RESPONSIBILITIES• Manage SQL database objects• Hands-on participation in database tasks such as coding, peer reviews, building automation tests.• Helping others to reach agreement on solutions for complex challenges• Working closely with development manager to align the development process internally.• Manage database permission for entire organization access• An innovative mindset who embraces change.• You will be responsible for deploying database scrips, objects in multiple flyadeal stages and run predictive analytics at scale.• Help and guide the Data Engineering team produce high-quality code that allows us to put solutions into production• Deep technical knowledge in engineering and agile practices with a passion for learning new or emerging technologies• experience in data engineering with an emphasis on data analytics and reporting.• Understanding of core business intelligence (BI)/data warehousing technology: RDBMS, Web, Client/ Server, and OLAP Skills• Non-Relational Database experience (Document DB, Graph DB, etc.)• Develop and maintain strong working relationships with different business functions and decision makers.• Investigate and propose implementing initiatives that result in positive financial and operation impact for flyadeal and mitigate financial and operational risks.• A leader who appreciates the importance of unlocking customer value at the earliest opportunity.• Help us to shape the next generation of our products.",flyadeal Egypt,Senior Data Engineer,https://www.naukrigulf.com/senior-data-engineer-jobs-in-jeddah-saudi-arabia-in-flyadeal-egypt-3-to-6-years-n-cd-40000971-jid-030424500053
Posted 30+ days ago,3 - 5 Years,Saudi Arabia,,Any Graduation(),"Job DescriptionRoles & ResponsibilitiesProject ManagerLocation : Riyadh, Saudi ArabiaRole Type : Permanent DescriptionIn a digital age where the nearly infinite and extravagant availability of data presents unlimited opportunities, our client is a key enabler in leveraging this resource, as it is among the first Saudi companies dedicated to offering market-leading Data Science and AI products and solutions. Our client empowers aspiring businesses and dynamic governments across industries to become data-driven, allowing them to optimize operations, enhance efficiency, and augment decision-making. As a Project Manager, you will be responsible for leading the projects from requirements definition through deployment, identifying schedules, scopes, budget estimations, and project implementation plans, including risk mitigation. As well as building and developing the project team to ensure maximum performance. Job Responsibilities• Participate in the allocation of budget, staff, and any other resources that are needed to accomplish or achieve set-out projects.• Manage, direct, support, and control all aspects of data science projects both internally and externally and ensure proper delivery within the identified timeframe, quality standards, cost, and scope of work.• Create required project documents, including project plans, progress reports, change requests, corrective action documents, and any supporting documents for the organization and its clients.• Manage project risks, including the development of contingency plans.• Responsible for following up on instructions and commitments associated with the project.• Liaise with third parties and communicate with project stakeholders to ensure proper engagement from all parties involved.• Working with other managers and functions leads to developing budgets, schedules, and plans for a project's various elements.• Negotiate necessary changes to the scope of work, project price, and time with the client, key subcontractors, and project team.• Assign responsibility for executing project plans to subordinates after careful assessment of how to utilize their qualifications and strengths.• Leading weekly meetings both with the project team and clients to review project status and create action items.• Develop and ensure the quality of project management policies, tools, and systems and reinforces organization standards.• Conduct project evaluation reviews and return on investment analysis to assess and document project outcomes.• Periodically reporting the performance of the projects with the senior management and ensuring alignment of the company s key targets with the performance of the Data Science Department.Requirements• Bachelor s and/or Master s degree in Management Information System, Industrial Engineering, business administration, or similar majors.• Project Management Professional (PMP) certificate. Preferred Business Skillset• Theoretical and/or practical project management knowledge.• Project management professional (PMP), PRINCE2, Scrum Master or similar certificate.• Knowledge and/or experience of project management techniques, tools, and software.• Experience or knowledge in strategic planning, project planning, risk management, and change management.• Prior exposure in the field of Data Science, AI, and Business Intelligence.• Proficiency in English and Arabic, including speaking, writing, and reading.",MUQAWLAT KUWAIT,Project Manager,https://www.naukrigulf.com/project-manager-jobs-in-saudi-arabia-in-muqawlat-kuwait-3-to-5-years-n-cd-40001574-jid-190324501257
Posted 30+ days ago,3 - 5 Years,Riyadh,,"Bachelor of Commerce(Commerce), Bachelor of Business Administration(Management)","Job DescriptionRoles & ResponsibilitiesThe MIS Finance Manager will play a crucial role in managing financial data, systems, and processes within MBC finance function. His responsibilities will include utilizing technical skills, optimizing financial workflows, and ensuring accurate reporting. Here are the key aspects of this role:Key responsibilities and accountabilitiesProcess Optimization :• Identify inefficiencies in financial processes and workflows and propose and implement process improvements to enhance efficiency, accuracy, and compliance.• Work closely with finance teams in different locations on aligning, unifying, and optimizing processes.• Document user procedures and processes.• Manage ad-hoc projects independently when needed. Oracle Fusion ERP Expertise :• Be the link between the different finance teams from one side and the technical ERP team on the other side to accelerate projects and improvements related to the finance function in the group.• Collaborate with finance and ERP departments to understand requirements, propose solutions, and support ERP team to configure or develop functionalities, and manage testing processes in finance.• Be the initial point of contact for resolving Oracle related issues in finance department.Power BI Skills :• Utilize Power BI for data visualization, reporting, and business intelligence and create interactive dashboards and reports to facilitate data-driven decision-making.• Desing semantic models from scratch and from sparse data points to use as a basis for data visualization. • Collaborate with stakeholders from finance department and the business planners across the group to identify KPIs and design relevant reports.Requirements• Bachelor s or master s degree in accounting, finance or information systems.• Relevant certifications such as PMP, Oracle-specific certifications or Power BI (or similar BI platforms) are advantageous.• Experience and familiarity in Oracle cloud ERP solutions.• Analytical, planning, and problem-solving skills.• Results oriented.• Technical knowledge in data analysis (such as: databases, SQL, Python) is advantageous.Unfortunately, due to the high number of responses we receive we are unable to provide feedback to all applicants. If you have not been contacted within 5-7 days, please assume that at this stage your application has been unsuccessful.",Middle East Broadcasting Networks Inc.,Finance Manager (MIS) - Riyadh,https://www.naukrigulf.com/finance-manager-riyadh-jobs-in-riyadh-saudi-arabia-in-middle-east-broadcasting-networks-inc-3-to-5-years-n-cd-10000150-jid-110324500101
Posted 30+ days ago,2 - 4 Years,Riyadh,,Bachelor of Education(Education),"Job DescriptionRoles & ResponsibilitiesInstitution:Prince Sultan UniversityLocation:Riyadh, Saudi ArabiaCategory:Computer SciencePosted:February 12, 2024Application Due:Open Until FilledType:Full-TimeFACULTY REQUIREDNumber of Faculty required: Open until filled for both male and female campuses.JOB SUMMARYThe College of Computer and Information Sciences at Prince Sultan University aims to provide world-class education in Computing, Information Systems, and Engineering for both undergraduate and graduate programs. The College offers Bachelor of Computer Science, Bachelor of Information Systems, Bachelor of Software Engineering, Master of Software Engineering, and Master of Cybersecurity programs. The Bachelor of Computer Science, Information Systems, and Software Engineering programs are ABET accredited.The College of Computer and Information Sciences is seeking applicants with the rank of Assistant Professor, Associate Professor, or Full Professor for the first semester of the coming academic year 2024/2025 which starts in September 2024.The candidate is expected to teach courses in the domains of Computer Sciences, Software Engineering, Information Systems, and Cybersecurity.• Computer Sciences (CS): the courses include Artificial Intelligence, Machine Learning, Interactive Digital Media, Graphic Design, 3D Modelling, Animation and Game Development.• Software Engineering (SE): The courses include Software Requirements Engineering, Design and Architecture, Quality Assurance and Testing, SW Construction, SW Maintenance, and SW Project Management.• Information Systems (IS): the courses include Financial Technology (Fintech), Quantitative Analysis, Business Intelligence and Data Science, Data Management and Governance, Digital Transformation, Knowledge Discovery and Information Management, Full stack Web Development, and Business Computing and E-commerce, Business Process Modelling, System Analysis and Design, and Database Design.• Cybersecurity (CYS): the courses include GRC Cyber Physical System Security, Penetration Testing and Ethical Hacking, and Cryptography.A suitable candidate would demonstrate:• PhD Degree in one of the above four specializations (CS/SE/IS/CYS) or Equivalent from an accredited university.• Quality teaching.• A track record of or potential to, secure external funding and produce high-quality research.• A track record of, or evidence of potential to, publish in leading international peer-reviewed journals (ISI and Scopus Q1, Q2).• Experience in supervising undergraduate and postgraduate research students.• The ability to develop new areas of the curriculum should the need arise.Successful candidates will be expected to teach courses at the undergraduate level, conduct research, supervise student work, and engage in academic scholarship and administrative work for the college and the community.For further details about the Software Engineering undergraduate program, please refer to the website: https://www.psu.edu.sa/CCISSALARY AND BENEFITSThe University is continuously expanding and its campus is situated in well-equipped new premises in north-central Riyadh.• We offer a one-year renewable contract (renewable subject to Dean/Director and student evaluation) and a competitive salary package based on academic qualification, rank, and teaching experience as stated above;• Other benefits include medical insurance coverage for the employee & dependents residing within the Kingdom, (spouse & 4 children below 24 years of age);• Transport allowance;• Round trip tickets (maximum 4: employee, spouse, and 2 children below 18 years of age) for annual leave with paid annual (summer) vacation of two (2) months, plus 2 local paid holidays of about 15 days each (as applicable);• Tuition fees of Saudi Riyals 30,000 maximum for children attending school within the Kingdom. Details will be specified in the contract.• Free, furnished accommodation plus essential utilities and maintenance will be provided subject to availability, OR the successful candidate will be provided a housing allowance based on academic rank.• End-of-service yearly gratuity, which starts on the 2nd year of continuous service (if the candidate completed a minimum of 2 years.)ABOUT PRINCE SULTAN UNIVERSITYPrince Sultan University is the first private university in Saudi Arabia to have been awarded accreditation by the National Commission for Assessment & Academic Accreditation (NCAAA). Further, it is the youngest university to have achieved such a milestone.Prince Sultan University is the first private university in Saudi Arabia and emphasizes excellence in teaching, research, and community services. PSU offers a Preparatory Year Program in which students develop their English, Mathematics, Computer, and Physical Education/Health and Recreation skills to the standards required for study.",Prince Sultan University,Faculty Position in Computer and Information Sciences,https://www.naukrigulf.com/faculty-position-in-computer-and-information-sciences-jobs-in-riyadh-saudi-arabia-in-prince-sultan-university-2-to-4-years-n-cd-10009046-jid-140224500269
Posted 30+ days ago,5 - 6 Years,Saudi Arabia,,Any Graduation(),"Job DescriptionRoles & ResponsibilitiesJob PurposeWe are currently seeking an experienced Planning & Performance Management Professional to join our Upstream Planning & Performance Management team based in Dhahran, Saudi Arabia.The successful candidate will be part of segment level finance team that handles the coordination, consolidation, and preparation of the Business Plan, Quarterly Business Reviews, Accountabilities, as well as other performance management related activities and ad hoc direct support to the Senior Management. It is a critical team within Upstream Finance, responsible for ensuring the delivery of accurate and fit-for-purpose information to the Management, in order to support effective and timely decision making.You will be collaborating with a wide range of stakeholders across the Upstream business and Finance organization. Therefore, the capability of interacting effectively with people of various hierarchical and technical backgrounds will be critical.The role provides a unique opportunity to understand and participate in the core business of Saudi Aramco, a key player in the global energy landscape and one of the most profitable companies worldwideResponsibilities• Plan, execute and lead planning and performance management analytical activities particularly in resolving complex, cross-functional, non-routine issues and prepare quality decision support materials.• Coordinate with other finance and operational employees at all levels in the collection, analysis and consolidation of data required for business plan, accountability reports, quarterly business reviews, risk analysis and other ad-hoc reports needed by senior management• Support the preparation of the financial statements and financial metrics for the quarterly forecast and business plan period including calculation and challenging key assumption inputs.• Lead special initiatives relating to design and re-design of performance measurements, processes and workflows, and information system-related changes• Evaluate and recommend optimal capital and operating expenditure budget allocation decisions during and outside planning cycles• Develop new financials models or review segment related models providing economic insights on earnings, investments and energy market matters.• Provide analysis on competition and industries, identify market trends and best practices, consolidate information into actionable items for reports and presentations. Use online market research to capture findings and conduct qualitative studies as needed.• Maintain the department risk register and follow up on the mitigation actionsEducation & Experience Requirements• A Bachelor s degree in a Business, Finance, or a related discipline.• A minimum of 12 years of relevant experience is required, with at least 5 years of experience directly related to the Upstream business.• Solid knowledge and understanding of management accounting, finance and excel is required.• Possession of an advanced business degree (e.g. MBA) and/or relevant professional certification (e.g. CPA, CMA, CFA, or equivalent) is preferred.• Demonstrable track record in the practice of planning & performance management with progressively increased responsibility throughout the career path.• Proficiency in the use of business intelligence tools (e.g. Spotfire, PowerBi).• Excellent command of oral & written English, with demonstrated capability of producing top quality written reports & presentations to senior-level audiences, including previous experience in delivering presentations to C-Suite• Ability to work with incomplete data and drive conclusions and recommendations to senior management• Working knowledge of SAP Finance Modules.• Self-driven professional with the mentality and ability to find solutions to any matter, both individually or collaboratively.• Seasoned professional with the authority and empathy needed to collaborate effectively across the organization.",Saudi Aramco,P&PM Specialist,https://www.naukrigulf.com/p-pm-specialist-jobs-in-saudi-arabia-in-saudi-aramco-5-to-6-years-n-cd-10000003-jid-150124500881
