posted,Experience,location,jobType,Education,description,name,title,feed
Posted 30+ days ago,10 - 12 Years,Riyadh,,Bachelor of Business Administration(Management),"Job DescriptionRoles & Responsibilities Job Summary: The Head ME Marketing is responsible for the marketing activities of Masimo products and services in the ME and for the management of country specific assigned projects  Duties & Responsibilities: • Develop and execute marketing plans for specific product lines, technologies and services, working closely with each Country and the corresponding stakeholders. • Develop, lead and execute product launch plans in the MENA. Define specific local needs to lead and ensure successful execution plans at targeted healthcare segments.• Develop Market Intelligence reporting documents, perform deep and thorough sales, market and data analysis, recommend market segmentation, targeting and positioning at a country level and care areas level.• Support upstream projects as needed. • Identify and engage Key Strategic Opinion Leaders. Develop and implement high quality continuing medical education programs at a pan-Middle East level as well as at country level. • Define, develop and execute specific high priority projects such as defining targeted audiences, best venues for specific digital campaigns and branding.• Develop programs to maximize customer engagement and lead generation, across the MENA and at a Country specific level. Track, document and report statistics and results from each initiative implemented, manage and assign leads within CRM systems, reporting results in time.• Coordinate, lead and develop Market Access Strategies and Processes, working closely with all corresponding stakeholders. • Proficient or rapidly become proficient in CRM software such as Salesforce.com.• Write and proofread documentation as needed.• Proficient or rapidly become proficient in content management and document control systems, such as Microsoft SharePoint and Oracle Agile PLM. Prepare documents for routing in document control system, as needed. Qualifications: • A minimum of 10 years of marketing/business marketing experience in medical device markets.• Experience in the fields of Hospital Automation, Hospital EHRs and Digital Healthcare is a strong positive asset• Experience with the SFDA and Middle East and International medical device regulatory processes or experience in highly regulated industries is required. • Experience in Market Access Strategies and programs is a positive asset• Prior experience with data analysis and business intelligence programs is a positive asset• Strong familiarity with product lifecycles and phase-in/phase out programs is required• Ability to work well within a team environment and independently• Results-oriented and positive ""can do"" attitude with a sense of urgency to get things done.• Excellent organizational, communication, and problem-solving skills.• Must be detail-oriented and flexible. Education:• University degree in Lifesciences, or engineering. MBA is a positive asset.• Fluent in Arabic and English is required. Other languages are a positive asset.",Masimo,Marketing Director,https://www.naukrigulf.com/marketing-director-jobs-in-riyadh-saudi-arabia-in-masimo-10-to-12-years-n-cd-10007511-jid-080724500108
Posted 3 days ago,3 - 5 Years,Eastern Province,,Bachelor of Education(Education),"Job DescriptionRoles & ResponsibilitiesGeneral Description   The College of Business Administration at Prince Mohammad Bin Fahd University (PMU) is seeking applications to fill a position in Management Information Systems at the rank of Assistant/ Associate/ or Full Professor. Candidates are expected to teach a wide variety of basic and advanced courses in their discipline. Full-time faculty members are also expected to attend faculty meetings and university events, serve on committees, and engage in academic scholarship and professional development activities. Qualifications & Experience (Required)  Applicants with research interests and experience in one or more of the following areas are especially encouraged to apply:• Minimum of 2-years teaching experience in Business Analytics and post-graduation in Analytics, Python, Power BI, Tableau, Business Intelligence, MySQL and Machine learning including advanced excel. • Experience in using management applications/ tools, simulation techniques and innovative teaching methods like flipped classroom. • Be able to deliver ""microcredentials"" in analytics. • Active researcher in Analytics. • Ph.D. holders from AACSB Accredited universities will be preferred. • Excellent research record.  Candidates must have earned a doctorate degree in Business Analytics or a closely related field from an accredited Western residential university. The ideal candidate also exhibits the following characteristics; • Excellent oral and written English communication skills. • A minimum of three years of demonstrated teaching excellence in programs in which English is used as the language of instruction. • An active research record as evidenced by publications in refereed journals and at conferences. • A strong willingness to become engaged in service to the university and the community, and to participate in department, college, and university initiatives, especially as they relate to accreditation. • Strong cultural awareness and sensitivity. • Experience with AACSB accreditation is highly beneficial. • Familiarity with technology-infused academic environments is required. • Previous experiences in the Middle East in general and in GCC countries in particular are an added bonus. • Suitable candidates applying for a position of Associate / Full Professor, candidates must provide a letter of promotion from an academic institution with a documented due process to the rank of Associate / Full Professor.   Knowledge, Skills and Abilities (Required)   • Maintain an appropriate scholarly or professional development activity and to keep up to date with developments in the field as necessary to carry out the duties of the position. • Participate in the comprehensive advisement of students majoring in the College. • Contribute to the overall work of the College and/or equivalent external organizations by representing the institution and faculty on appropriate committees and groups. • Effectively contribute to the management and administrative processes and committee structures of the School, faculty, and College, as required. • Participate in, manage, or lead major initiatives or areas of work (as either sustained or one-time projects) that facilitate School, faculty, or College performance and accreditation, as required. • Participate in the recruitment, management, development, and mentoring of colleagues, as required. • And perform any and all other position-related duties as requested by Chair, Dean, Vice President, or President.   Duties and Responsibilities  General• Carry out the duties of the position in accordance with College values and standards and in line with College policies and procedures, upholding high professional standards and leading by example. • Work with our students as members of a learning community to provide world-class education and an excellent student experience. • Integrate the College value of inclusiveness into all appropriate aspects of the job, respecting the dignity and diversity of all members of the College community and of visitors to the College. • Promote the values of collegiality within the College community.  Teaching and other academic duties• Contribute at an appropriate level to school and faculty policy and practice in teaching and research. • Play a significant role in the design, development, and planning of courses and programs within the subject area as required. • Play a significant role in the review of courses and programs and in assessment, quality assurance, and quality enhancement as required. • Develop innovative approaches to learning and teaching as appropriate. • Provide timely feedback and assessment of coursework and examinations. • Provide general support and guidance to students, resolving issues and/or referring to specialist parties, where appropriate.  Remuneration and Benefits PMU offers an income tax-free compensation package, commensurate with rank and experience, including 12-month salary, PMU accommodation, annual vacation, and annual round-trip airfare to the home country, medical insurance and end of contract benefits.",Prince Mohammad Bin Fahd University,"Assistant Professor, Business Analytics",https://www.naukrigulf.com/assistant-professor-business-analytics-jobs-in-dammam-khobar-eastern-province-saudi-arabia-in-prince-mohammad-bin-fahd-university-3-to-5-years-n-cd-10000966-jid-300824500341
Posted 30+ days ago,2 - 3 Years,Eastern Province,,Any Graduation(),"Job DescriptionRoles & ResponsibilitiesTechnological progress and scientific discoveries have made economic activity mostly knowledge-based and have accelerated growth. It is only possible to meet all the challenges thus imposed, through decisions that are mainly based on research and studies that take into consideration the problems but also anticipate future trends and global expectations. Decision makers are in dire need for research and in-depth and futuristic studies that produce enlightened recommendations and help make the most suitable choices, while avoiding risks and overcoming challenges.Prince Mohammad bin Fahd University strives to develop human intelligence, disseminate knowledge and find solutions based on research and scientific studies of problems experienced by societies. Based on its vision and mission in serving the local and international communities, and with the expertise, potential and facilities supporting scientific research and studies, and outreach activities, the University is inviting applications for the faculty positions in the Information Technology Department in the College of Computer Engineering and Science.  Qualifications & Experience (Required)  The quality of educational trainings and academic careers obtained by the Faculty Members for Information Technology in Western university is vital to PMU.  • A Ph.D. in Information Technology or related field from an accredited, reputable Western university. A Master's degree with good teaching experience may be considered especially in teaching freshman and sophomore courses and laboratory modules. • Candidates should have a minimum 2-3 years teaching experience after the terminal degree with good research experience, including publications in international Journals and Conferences. • Industrial experience is a Plus. • Candidates are expected to have excellent command of the English Language. • Candidates should be familiar with technology infused academic environments. • Previous experience in the  Middle East  or  GCC  countries is a plus.   In order to apply for a position of Associate / Full Professor, candidates must provide a letter of promotion from an academic institution with a documented due process to the rank of Associate / Full Professor.  Duties and Responsibilities  General• To carry out the duties of the position in accordance with College values and standards and in line with College policies and procedures, upholding high professional standards and leading by example. • To work with our students as members of a learning community to provide world-class education and an excellent student experience. • To integrate the College value of inclusiveness into all appropriate aspects of the job, respecting the dignity and diversity of all members of the College community and of visitors to the College. • To promote the values of collegiality within the College community.  Teaching• To contribute at an appropriate level to school and faculty policy and practice in teaching. • To play a significant role in the design, development, and planning of courses and programs within the subject area as required. • To play a significant role in the review of courses and programs and in assessment, quality assurance, and quality enhancement as required. • To develop innovative approaches to learning and teaching as appropriate. • To provide timely feedback and assessment of coursework and examinations. • To provide general support and guidance to students, resolving issues and/or referring to specialist parties, where appropriate.  Scholarly and Professional Development and Service• To maintain an appropriate scholarly or professional development activity and to keep up to date with developments in the field as necessary to carry out the duties of the position. • To participate in the comprehensive advisement of students majoring in the College. • To contribute to the overall work of the College and/or equivalent external organizations by representing the institution and faculty on appropriate committees and groups. • To effectively contribute to the management and administrative processes and committee structures of the School, faculty, and College, as required. • To participate in, manage, or lead major initiatives or areas of work (as either sustained or one-time projects) that facilitate School, faculty, or College performance and accreditation, as required. • To participate in the recruitment, management, development, and mentoring of colleagues, as required. • And to perform any and all other position-related duties as requested by Chair, Dean, Vice President, or President.  Knowledge, Skills and Abilities (Required)  Candidates are expected to have research interest and experience in teaching some of the following areas: • Mobile Application Development (iOS, Android platforms) • Network Administrations • Systems Administrations • Information Security • Ethical Hacking • Cloud computing • Database • Data Analytics • Business Intelligence",Prince Mohammad Bin Fahd University,"Full Professor, Information Technology",https://www.naukrigulf.com/full-professor-information-technology-jobs-in-dammam-khobar-eastern-province-saudi-arabia-in-prince-mohammad-bin-fahd-university-2-to-3-years-n-cd-10000966-jid-020224500302
Posted 30+ days ago,2 - 3 Years,Eastern Province,,Bachelor of Science(Computers),"Job DescriptionRoles & Responsibilities Technological progress and scientific discoveries have made economic activity mostly knowledge-based and have accelerated growth. It is only possible to meet all the challenges thus imposed, through decisions that are mainly based on research and studies that take into consideration the problems but also anticipate future trends and global expectations. Decision makers are in dire need for research and in-depth and futuristic studies that produce enlightened recommendations and help make the most suitable choices, while avoiding risks and overcoming challenges.Prince Mohammad bin Fahd University strives to develop human intelligence, disseminate knowledge and find solutions based on research and scientific studies of problems experienced by societies. Based on its vision and mission in serving the local and international communities, and with the expertise, potential and facilities supporting scientific research and studies, and outreach activities, the University is inviting applications for the faculty positions in the Information Technology Department in the College of Computer Engineering and Science.  Qualifications & Experience (Required)  The quality of educational trainings and academic careers obtained by the Faculty Members for Information Technology in Western university is vital to PMU.  • A Ph.D. in Information Technology or related field from an accredited, reputable Western university. A Master's degree with good teaching experience may be considered especially in teaching freshman and sophomore courses and laboratory modules. • Candidates should have a minimum 2-3 years teaching experience after the terminal degree with good research experience, including publications in international Journals and Conferences. • Industrial experience is a Plus. • Candidates are expected to have excellent command of the English Language. • Candidates should be familiar with technology infused academic environments. • Previous experience in the  Middle East  or  GCC  countries is a plus.   In order to apply for a position of Associate / Full Professor, candidates must provide a letter of promotion from an academic institution with a documented due process to the rank of Associate / Full Professor.  Duties and Responsibilities  General• To carry out the duties of the position in accordance with College values and standards and in line with College policies and procedures, upholding high professional standards and leading by example. • To work with our students as members of a learning community to provide world-class education and an excellent student experience. • To integrate the College value of inclusiveness into all appropriate aspects of the job, respecting the dignity and diversity of all members of the College community and of visitors to the College. • To promote the values of collegiality within the College community.  Teaching• To contribute at an appropriate level to school and faculty policy and practice in teaching. • To play a significant role in the design, development, and planning of courses and programs within the subject area as required. • To play a significant role in the review of courses and programs and in assessment, quality assurance, and quality enhancement as required. • To develop innovative approaches to learning and teaching as appropriate. • To provide timely feedback and assessment of coursework and examinations. • To provide general support and guidance to students, resolving issues and/or referring to specialist parties, where appropriate.  Scholarly and Professional Development and Service• To maintain an appropriate scholarly or professional development activity and to keep up to date with developments in the field as necessary to carry out the duties of the position. • To participate in the comprehensive advisement of students majoring in the College. • To contribute to the overall work of the College and/or equivalent external organizations by representing the institution and faculty on appropriate committees and groups. • To effectively contribute to the management and administrative processes and committee structures of the School, faculty, and College, as required. • To participate in, manage, or lead major initiatives or areas of work (as either sustained or one-time projects) that facilitate School, faculty, or College performance and accreditation, as required. • To participate in the recruitment, management, development, and mentoring of colleagues, as required. • And to perform any and all other position-related duties as requested by Chair, Dean, Vice President, or President.  Knowledge, Skills and Abilities (Required)  Candidates are expected to have research interest and experience in teaching some of the following areas: • Mobile Application Development (iOS, Android platforms) • Network Administrations • Systems Administrations • Information Security • Ethical Hacking • Cloud computing • Database • Data Analytics • Business Intelligence",Prince Mohammad Bin Fahd University,"Associate Professor, Information Technology",https://www.naukrigulf.com/associate-professor-information-technology-jobs-in-dammam-khobar-eastern-province-saudi-arabia-in-prince-mohammad-bin-fahd-university-2-to-3-years-n-cd-10000966-jid-020224500305
Posted 30+ days ago,3 - 4 Years,Riyadh,,Bachelor of Science(Computers),"Job DescriptionRoles & ResponsibilitiesAs a Reporting & Market Intelligence Analyst, you will play a critical role within the Strategic Development team, reporting directly to the Partnership Strategy Manager.Your primary responsibility will be to gather, analyze, and report on market data that will shape strategic decisions regarding our partnerships. Your expertise in market research, data analysis, and reporting will be vital in uncovering insights that will drive the success of our partnerships.Key Responsibilities Market Intelligence:• Conduct thorough research and analysis of industry trends, competitor activities, and market opportunities.• Stay informed of market conditions, regulatory changes, and other external factors that could impact strategic partnerships.Data Collection & Analysis:• Systematically collect data from various internal and external sources, ensuring its accuracy and relevance.• Use statistical tools to analyze data and identify significant patterns and trends.Reporting:• Develop regular reports on market findings and insights to support the strategic planning process.• Create and maintain dynamic BI dashboards that provide real-time data to the team and senior management.Strategic Support:• Collaborate with the Partnership Strategy Manager to translate market insights into actionable partnership strategies.• Support the strategic planning process with detailed market analysis reports and presentations.Collaborative Data Synthesis:• Work closely with other analysts and departments to compile comprehensive market intelligence reports.• Synthesize data from various teams to provide a holistic view of market intelligence.Feedback and Recommendations:• Provide feedback on current strategies and recommend changes or new directions based on market data.• Present data-driven insights and recommendations in team meetings and to senior stakeholders.",Salla,Reporting & Market Intelligence Analyst,https://www.naukrigulf.com/reporting-market-intelligence-analyst-jobs-in-riyadh-saudi-arabia-in-salla-3-to-4-years-n-cd-10008634-jid-310724500573
