posted,Experience,location,jobType,Education,description,name,title,feed
Posted 30+ days ago,2 - 3 Years,Eastern Province,,Any Graduation(),"Job DescriptionRoles & Responsibilities*AL-KHOBAR, KINGDOM OF SAUDI ARABIA Position   Assistant / Associate / Full Professor in Information TechnologyDepartment   Department of Information TechnologySchool   College of Computer Engineering and ScienceReports to    Department Chair; College Dean  introduction  Technological progress and scientific discoveries have made economic activity mostly knowledge-based and have accelerated growth. It is only possible to meet all the challenges thus imposed, through decisions that are mainly based on research and studies that take into consideration the problems but also anticipate future trends and global expectations. Decision makers are in dire need for research and in-depth and futuristic studies that produce enlightened recommendations and help make the most suitable choices, while avoiding risks and overcoming challenges.Prince Mohammad bin Fahd University strives to develop human intelligence, disseminate knowledge and find solutions based on research and scientific studies of problems experienced by societies. Based on its vision and mission in serving the local and international communities, and with the expertise, potential and facilities supporting scientific research and studies, and outreach activities, the University is inviting applications for the faculty positions in the Information Technology Department in the College of Computer Engineering and Science.  Qualifications & Experience (Required)  The quality of educational trainings and academic careers obtained by the Faculty Members for Information Technology in Western university is vital to PMU.  • A Ph.D. in Information Technology or related field from an accredited, reputable Western university. A Master's degree with good teaching experience may be considered especially in teaching freshman and sophomore courses and laboratory modules. • Candidates should have a minimum 2-3 years teaching experience after the terminal degree with good research experience, including publications in international Journals and Conferences. • Industrial experience is a Plus. • Candidates are expected to have excellent command of the English Language. • Candidates should be familiar with technology infused academic environments. • Previous experience in the  Middle East  or  GCC  countries is a plus.   In order to apply for a position of Associate / Full Professor, candidates must provide a letter of promotion from an academic institution with a documented due process to the rank of Associate / Full Professor.  Duties and Responsibilities  General• To carry out the duties of the position in accordance with College values and standards and in line with College policies and procedures, upholding high professional standards and leading by example. • To work with our students as members of a learning community to provide world-class education and an excellent student experience. • To integrate the College value of inclusiveness into all appropriate aspects of the job, respecting the dignity and diversity of all members of the College community and of visitors to the College. • To promote the values of collegiality within the College community.  Teaching• To contribute at an appropriate level to school and faculty policy and practice in teaching. • To play a significant role in the design, development, and planning of courses and programs within the subject area as required. • To play a significant role in the review of courses and programs and in assessment, quality assurance, and quality enhancement as required. • To develop innovative approaches to learning and teaching as appropriate. • To provide timely feedback and assessment of coursework and examinations. • To provide general support and guidance to students, resolving issues and/or referring to specialist parties, where appropriate.  Scholarly and Professional Development and Service• To maintain an appropriate scholarly or professional development activity and to keep up to date with developments in the field as necessary to carry out the duties of the position. • To participate in the comprehensive advisement of students majoring in the College. • To contribute to the overall work of the College and/or equivalent external organizations by representing the institution and faculty on appropriate committees and groups. • To effectively contribute to the management and administrative processes and committee structures of the School, faculty, and College, as required. • To participate in, manage, or lead major initiatives or areas of work (as either sustained or one-time projects) that facilitate School, faculty, or College performance and accreditation, as required. • To participate in the recruitment, management, development, and mentoring of colleagues, as required. • And to perform any and all other position-related duties as requested by Chair, Dean, Vice President, or President.  Knowledge, Skills and Abilities (Required)  Candidates are expected to have research interest and experience in teaching some of the following areas: • Mobile Application Development (iOS, Android platforms) • Network Administrations • Systems Administrations • Information Security • Ethical Hacking • Cloud computing • Database • Data Analytics • Business Intelligence   Remuneration and Benefits PMU offers an income tax-free compensation package, commensurate with rank and experience, including 12-month salary, PMU accommodation, annual vacation, and annual round-trip airfare to the home country, medical insurance and end of contract benefits.",Prince Mohammad Bin Fahd University,"Assistant Professor, Information Technology",https://www.naukrigulf.com/assistant-professor-information-technology-jobs-in-dammam-khobar-eastern-province-saudi-arabia-in-prince-mohammad-bin-fahd-university-2-to-3-years-n-cd-10000966-jid-020224500937
Posted 30+ days ago,12 - 15 Years,SA,,Any Graduation(),"Job DescriptionRoles & ResponsibilitiesOverviewWe are seeking a seasoned Financial Planning & Performance Management Analyst to join the Strategy and Corporate Development Planning and Performance Management Department (S&CD P&PMD).S&CD P&PMD is primarily responsible for the coordination, consolidation and preparation of Business Plan and Midyear/Year-end Accountability reporting and presentations for organizations and admin Areas within the service line. The Department includes personnel serving as liaisons with the various business segments and units, coordinating planning activities, performing variance analysis and resolving issues.Duties & ResponsibilitiesThe successful candidate will:Plan, execute and lead planning and performance management (P&PM) analytical activities under the broad guidance of higher-level P&PM staff and supervisors of the hiring organization, particularly in resolving complex, cross-functional, non-routine and/or design issuesGenerate analytical findings and recommendations across the scope of objectives and deliverables of the organization, either independently or in collaboration with othersProactively identify and provide solutions for problems and issues that arise in his/her assigned areasDevelop and maintain close partnerships with business/operational counterparts of the P&PM organization in his/her assigned areas, and represent his/her organization in cross-functional, cross-organizational teams involved in P&PM-related tasksParticipate in planning initiatives of his/her organization, may be assigned to lead and supervise work streams and be significantly involved in mentoring others on P&PM practice.You will also be required to perform the following within tight deadlines:Provide analytical findings and recommendations relating to regular P&PM tasks, such as business plan preparation, performance tracking measurement, and performance analysis and accountability reporting.Conduct special P&PM-related studies, such as the development of performance initiatives and business cases, benchmarking, risk management, design and redesign of measurements, processes and workflows, and information system-related changes.Provide supervision, coordination and/or facilitation in the execution of regular and special tasks by other P&PM personnel, as well as mentorship on P&PM analytical practice.Perform other related staff and analytical duties, as assigned.Minimum RequirementsAs the successful candidate, you will hold a Bachelor s degree in Business, Engineering, or a related discipline. Possession of an advanced business degree (e.g., MBA) and/or relevant professional certification (e.g., CMA, CFA, CPA) is preferred.You should have 12 years of related experience, including a demonstrated capability and track record, in the practice of planning and performance management, and in the use of business intelligence tools.Possess solid knowledge and understanding of management accounting, finance and Excel.Previous experience in Oil & Gas is preferred but not required.Have an excellent command of oral and written English.Working environmentOur high-performing employees are drawn by the challenging and rewarding professional, technical and industrial opportunities we offer, and are remunerated accordingly.At Aramco, our people work on truly world-scale projects, supported by investment in capital and technology that is second to none. And because, as a global energy company, we are faced with addressing some of the world s biggest technical, logistical and environmental challenges, we invest heavily in talent development.We have a proud history of educating and training our workforce over many decades. Employees at all levels are encouraged to improve their sector-specific knowledge and competencies through our workforce development programs one of the largest in the world.",Saudi Aramco,Lead Planning & Performance Management Analyst,https://www.naukrigulf.com/lead-planning-performance-management-analyst-jobs-in-saudi-arabia-in-saudi-aramco-12-to-15-years-n-cd-10000003-jid-061123500439
Posted 30+ days ago,3 - 5 Years,Eastern Province,,"Bachelor of Commerce(Commerce), Bachelor of Business Administration(Management)","Job DescriptionRoles & Responsibilities*B. Duties and Responsibilities *The following are all aspects of a financial analyst s duties:1. Perform financial forecasting, reporting, and operational metrics tracking2. Analyze financial data and create financial models for decision support3. Report on financial performance and prepare for regular leadership reviews4. Analyze past results, perform variance analysis, identify trends, and make recommendations for improvements5. Work closely with the accounting team to ensure accurate financial reporting6. Evaluate financial performance by comparing and analyzing actual results with plans and forecasts7. Guide the cost analysis process by establishing and enforcing policies and procedures8. Provide analysis of trends and forecasts and recommend actions for optimization9. Recommend actions by analyzing and interpreting data and making comparative analyses; study proposed changes in methods and materials10. Identify and drive process improvements, including the creation of standard and ad-hoc reports, tools, and Excel dashboards11. Increase productivity by developing automated reporting/forecasting tools12. Perform market research, data mining, business intelligence, and valuation comps13. Maintain a strong financial analysis foundation creating forecasts and modelsProficiency with Microsoft Excel is mentioned in virtually any financial analyst job description; familiarity with data query/data management tools is extremely helpful (Access, SQL, Business Objects)C. Basic QualificationsBA, BS, or B.Com degree required (Bachelor s Degree in Accounting/Finance/Economic)3 years of business finance or other relevant experienceHigh proficiency in financial modeling techniquesStrong fluency with Excel formulas and functionsStrong analytical and data gathering skillsGood business acumenD. Preferred Qualifications5 years of healthcare business finance or other relevant experienceMBAs are preferredFinance, Accounting, Economics, or Statistics are preferred major fieldsProven work experience in a healthcareFMVA or similar designations preferredStrong quantitative and analytical competencyAdvanced knowledge of ExcelE. Personality and Interpersonal Skills1. Ability to streamline functions and passion to learn and grow2. Strong interpersonal skills, including written and oral communication skills3. Comfort dealing with ambiguity and the ability to work independently4. Experience working with, and presenting to, senior executives5. Excellent communication and presentation skills; be comfortable interacting with executive-level management6. Strong financial modeling experience*F. Work structure and environment *The financial analyst will be reporting directly to the chief of strategic business developmentHe / She will work in an office environment and is required to fulfill 48 working hours per weekWhenever needed by the business he/she will put extra hours to finish the tasks in handHe might also be asked to complete and grow financial performance through analysis of financial results, forecasts, variances, and trends of the hospitalCreate recommendations to be presented to management and executivesDevelop financial models to support valuation, planning, and forecastingAid in the capital budgeting and expenditure planning processesConduct comparable analysis and market research to support internal financial analysisMaintain up-to-date technical knowledge of financial instruments, market conditions, and trends.",Almoosa Specialist Hospital,Financial Analyst,https://www.naukrigulf.com/financial-analyst-jobs-in-dammam-khobar-eastern-province-saudi-arabia-in-almoosa-specialist-hospital-3-to-5-years-n-cd-10008615-jid-110123500675
,,,,,,,,https://www.naukrigulf.com/project-manager-jobs-in-riyadh-saudi-arabia-in-client-of-catenon-worldwide-executive-search-1-to-2-years-n-cd-10050750-jid-060824501197
Posted on 5 Aug,10 - 17 Years,Saudi Arabia,,Bachelors in Computer Application(Computers),"Job DescriptionRoles & Responsibilities• Assess, design and implement improvements in policies and processes related to communication/ coordination of data governance initiatives like data quality, access management etc. • Establish and maintain clearly defined data roles and responsibilities at the strategic & operational levels with focus on decision making and issue resolution responsibilities.• Work and collaborate on defining and designing various governance templates, SLAs and benchmarks on policies including communications, data exchanges, retention, escalation timelines, quality etc.• the formulation of relevant policies across data governance categories, including access, lineage, quality, security, change management, environment and monetization• Adhere to governance calendar and ensure that all governance meetings and agendas are met on stipulated timeliness• Drive effective management/completion of projects through Project plan, risk management, escalations and resource management.• Execute end to end Data Governance program on waterfall or agile methodology with best practices and methodologies based on need • Serve as a liaison between business, IT and functional area leadership to develop and maintain effective relationship to ensure focus on delivery aligned to DG Program i.e. business glossary, data lineage, integration, security, stewardship etc.• Effectively communicate relevant project information including status reports from projects work streams to senior management and project team• Manage the improvement and implementation of the data management program activities such as data directory, data sharing and data revenue generation. • Responsible for monitoring and updating the progress on the implementation activities, including documenting the requirements, preparing a report to showcase performance progress and sharing further suggestions for improvements. • Coordinating with Data Champion (business data specialists) and Data Steward (business data representatives) from each department to obtain a report on all the data management systems used• Conducting data management compliance assessmentEnsure adherence to data governance policies and regulations, such as NDMO, PDPL, GDPR, CCPA, HIPAA, or industry-specific requirements.• Monitor and enforce compliance with enterprise-wide data standards across all ARBs data domain in coordination with compliance officerMinimum Qualifications:• Bachelor s degree in computer science or related field.Minimum Mandatory Experience:• 10+ years of experience in field of Data in Financial domain. • Experience in project management • Preferred experience and knowledge in data management • Experience of handling Data Governance projects • Strong communication and relationship building skills • Effective communication, stakeholder management and interpersonal skills • Expert knowledge of Banking industry and related products. • Expert in Data Governance tools such as Informatica Data Quality , Enterprise Data Catalog, Axon, Data Privacy • Strong knowledge of data governance principles, frameworks, and best practices. • In-depth understanding of data privacy and security regulations (e.g., NMDO, GDPR, PDPL, CCPA) and their implications on data governance. • Familiarity with data management technologies, tools, and methodologies. • Ability to lead and manage cross-functional teams and influence change within the organization. • Experience in compliance management, risk assessment, or data governance roles, preferably in a leadership capacity. Preferable• Knowledgeable in Database Management Systems and Enterprise Data Warehouse• Knowledgeable in Business Intelligence and AICandidates with Techno-functional experience in banking industry",Wipro,Data Governance Manager,https://www.naukrigulf.com/data-governance-manager-jobs-in-saudi-arabia-in-wipro-10-to-17-years-n-cd-20010126-jid-060824500855
Employer ActivePosted Today,2 - 4 Years,Riyadh,,Bachelors in Computer Application(Computers),"Job DescriptionRoles & ResponsibilitiesThis position is on behalf of one of our client companies, not a direct role with ImployAs a Lead Analyst, you will be a pivotal member of our team, responsible for driving data-driven insights that inform strategic decisions. You will lead a team of analysts, mentor their development, and ensure the delivery of high-quality analyses. Your expertise will be instrumental in identifying trends, opportunities, and risks, enabling us to optimize our operations and achieve our business objectives.Responsibilities:Team Leadership: Manage and mentor a team of analysts, providing guidance, training, and support. Assign tasks, monitor progress, and ensure timely delivery of deliverables. Foster a collaborative and high-performing team culture.Data Analysis: Develop and implement data analysis methodologies and frameworks. Conduct in-depth analyses of complex datasets to extract meaningful insights. Identify trends, patterns, and anomalies within data. Communicate findings clearly and effectively to both technical and non-technical audiences.Business Intelligence: Develop and maintain data dashboards and reports to provide real-time visibility into key performance indicators. Identify opportunities for data-driven process improvement and optimization. Collaborate with business stakeholders to understand their needs and provide actionable recommendations.Project Management: Lead data analysis projects from inception to completion, ensuring adherence to timelines and budgets. Manage project resources, including personnel and technology. Coordinate with cross-functional teams to gather and integrate data from various sources.Qualifications: Advanced degree in a quantitative field (e.g., statistics, mathematics, economics, computer science) or equivalent experience. Proven experience as a Lead Analyst or in a similar role. Strong proficiency in data analysis tools and techniques (e.g., SQL, Python, R, Tableau, Power BI). Excellent problem-solving and analytical skills. Strong communication and interpersonal skills. Ability to work independently and as part of a team.",Client of imploy,Lead Analyst,https://www.naukrigulf.com/lead-analyst-jobs-in-riyadh-saudi-arabia-in-client-of-imploy-2-to-4-years-n-cd-50000292-jid-020924501348
Employer ActivePosted Today,2 - 5 Years,Saudi Arabia,,Any Graduation(),"Job DescriptionRoles & Responsibilities• Experience in data modeling and database design experience particularly with Microsoft SQL Server.• Familiarity with the development and deployment of distributed web application (.NET, DCOM) architecture.• Database management (MS SQL Server, Azure SQL, Oracle).• Integration of enterprise server side technology with mobility solutions (iOS and Android Based Mobile Platforms).• Familiarity with enterprise application framework ((Angular JS, .Net Framework, REST) Protocols (SOAP; HTTP, TCP/UDP).• Familiarity with ETL or Business Intelligence Analytic tools.• Familiarity with Networking and security setup in context of potentially impacting application installation and configuration• Middleware Integration with web services (eg. Biztalk, Scribe, Websphere, Web-logic, SAP etc.).",Client of Falcon Services,IFS support,https://www.naukrigulf.com/ifs-support-jobs-in-saudi-arabia-in-client-of-falcon-services-2-to-5-years-n-cd-10051037-jid-020924500361
Posted 3 days ago,5 - 8 Years,Riyadh,,Bachelor of Hotel Management(Hotel Management),"Job DescriptionRoles & ResponsibilitiesJob Description• Ensuring guest and employee satisfaction, while maintaining market competitiveness and exceptional financial performance.• Ensuring appropriate hiring, training, motivating, coaching, and developing of department s team members.• Responsible for ensuring the smooth daily operation of the Food and Beverage Department.• Develop and administer the F&B budget, action plan and promotional activities of the department to stimulate sales and profit while controlling operating expenses.• Surveying, reviewing and analyzing competition, market trends, customer needs and comments in order to be proactive and adapt with business intelligence.  • Evaluating changes in guest needs, the guest mix and competitive set, to recommend appropriate product/service and operational changes as necessary.• Attend and actively participate in weekly Head of Department meetings respecting the confidentiality of issues which may be discussed formally or informally.• Manage the service of food and beverage within the restaurant, caf , bar, and in room dining.• Ensure cleaning and maintenance of outlets, work areas, tableware, utensils and other materials and equipment used by restaurant, bar, room service and conference areas.• Regular liaison with the Engineering Department ensuring that maintenance requests are completed quickly focusing on guest needs as a priority.• Coordinate between Conference and Events, Food & Beverage and Front Office to ensure that preparations for conference events involving Front Office/ Housekeeping have been made.• Assist in the preparation monthly restaurant and cafe reports, commenting on key performance indicators and action taken to keep on target.• Management and guidance of outlet staff under control, namely Managers, Food & Beverage Supervisors/ Team Leaders and Food and Beverage Attendants.• Prepare weekly and monthly forecasts for restaurant, room service and cafe areas.• Be knowledgeable of and operate within appropriate outlets and hotel liquor licensing guidelines and House Management Policies.• Any other duties as assigned.",AccorHotel,Director of Food & Beverage,https://www.naukrigulf.com/director-of-food-beverage-jobs-in-riyadh-saudi-arabia-in-accorhotel-5-to-8-years-n-cd-10050787-jid-300824500692
