name,key,title,location,jobType,posted,days_ago,rating,experience,salary,education,feed,link,Tools,Soft Skills,Industry Skills,Data Jobs Keywords,description,date
EPAM Systems,d8491687ea4ba9d1,Senior/Lead Data Scientist,Dammam,,30 days ago,30,3.8,[],[],[],https://www.epam.com/careers/job-listings/job.96106.senior-lead-data-scientist_dammam_saudi-arabia,https://indeed.com/cmp/Epam-Systems,"['pandas', 'python', 'numpy', 'scikit-learn']","['analysis', 'coaching', 'communication', 'professional', 'communication skills', 'decision-making', 'research', 'design', 'problem-solving', 'organization', 'leadership']","['data analysis', 'data ingestion', 'data modeling', 'machine learning', 'data mining']","['Python', 'Data Mining', 'Scikit-learn', 'Data Analysis', 'Data Science', 'Machine Learning']","about the role as a senior/lead data scientist at epam, you play a key role in designing, developing and implementing both classic machine learning models and llm-based solutions to support project needs. collaborating with cross-functional teams, you will understand their requirements and devise solutions to address them effectively. your expertise in data modeling, evaluation processes and genai along with strong communication skills will be essential in conveying results and insights to technical and non-technical stakeholders. if this sound like something you’d be interested in, we’re looking for team members to contribute to an ambitious project set to revolutionize financial decision-making, focusing on developing an advanced application that integrates tax models, data ingestion techniques and decision-making factors. apply today and engineer the future with epam! responsibilities lead a team to design, develop and implement machine learning models and data analysis techniques to support project needs collaborate with cross-functional teams to understand their needs and devise possible solutions implement data modeling and evaluation processes communicate results and insights to technical and non-technical stakeholders stay current with latest research and technology ideas; share knowledge by clearly articulating results and ideas to key decision makers requirements proven experience as a data scientist or similar role, preferably in the financial sector strong knowledge of machine learning models, data mining and data analysis techniques familiarity with tax models and financial calculations proficient in python and data science libraries such as pandas, numpy and scikit-learn excellent communication and leadership skills strong problem-solving ability our benefits include competitive compensation depending on experience and skills general organization for social insurance (gosi) regular performance feedback and salary reviews private healthcare and life insurance end of service gratuity annual air travel tickets for expatriates global travel medical and accident insurance referral bonuses flexible schedule and work from home opportunities (depending on the project) great learning and development opportunities, including in-house professional training, career advisory and coaching, sponsored professional certifications, well-being programs, linkedin learning solutions and much more certain benefits and perks may be subject to eligibility requirements about epam epam is a leading global provider of digital platform engineering and development services. we are committed to having a positive impact on our customers, our employees, and our communities. we embrace a dynamic and inclusive culture. here you will collaborate with multi-national teams, contribute to a myriad of innovative projects that deliver the most creative and cutting-edge solutions, and have an opportunity to continuously learn and grow. no matter where you are located, you will join a dedicated, creative, and diverse community that will help you discover your fullest potential",2024-06-26
Chemdelves,800e1d1426699a4d,Computer Vision Engineer,Saudi Arabia,,30+ days ago,30,,['5+'],[],[],https://chemdelve.com/careers.html,https://indeed.com/cmp/Chemdelves,"['tensorflow', 'keras', 'python', 'github']","['focus', 'collaboration', 'design', 'presentation skills', 'innovation']","['scripting', 'machine learning', 'deep learning']","['Python', 'Keras', 'TensorFlow', 'Deep Learning', 'Analytics', 'Computer Vision', 'Machine Learning']","company profile chemdelve is hiring candidates to serve its client in saudi arabia. our client artificial intelligence global company is a platform independent service provider for industrial software application for process industry. it is one of its kind in the region developing integrated center of excellence for artificial intelligence centered it and ot applications. it infuses with intelligence to empower people to shape a sustainable future. we work in collaboration with our technology partners to sponsor their state-of-the-art applications to our customers. we provide a broad spectrum of advance engineering and operational support services with key focus on artificial intelligence and other digital solutions and services for oil, gas, petrochemical/chemical, power and manufacturing industries as well as smart cities across the region. we provide healthy environment to harmonize human intelligence with technological innovation that might develop our human assets and clients alike. key responsibilities build computer vision applications for the data captured from fixed cameras or drones. should be able to analyze the images for industrial complex like power plants, power distribution, refineries, petrochemical etc. ability to select the appropriate classified image libraries and algorithms to develop anomaly detection application should be able to program the application to automate the detection. should be well versed with various imaging formats. assist in installation and running of product demonstrations. test and reform algorithms to analyze videos images and improve detection sensitivity. evaluate various state-of-the-art computer vision algorithms and recommend the best fit for case-to-case basis. develop and automate application to support routine inspection through drones. port, implement, and optimize analytics and machine learning algorithms using special purpose computing architectures. secondary support and bug fixing for active applications at client sites contribute in expanding and sustain knowledge base through training and mentoring of peers and subordinates. establish technical performance benchmark support sales team during bidding process with technical clarifications support project team with estimates, schedules and resources loading. develop solution architecture and generate draft for design reviews. help in developing project documentation and client training. skills &amp; experience minimum 5+ years of work in building computer vision applications using ai hands on and strong project experience in developing computer vision applications using framework and image libraries: open cv, tensorflow and keras. well versed and proficient in python, c++ scripting languages experience in to industrial computer vision applications using ai experience of working drone based data (nice to have) experience in latest computer vision frameworks for pre-trained models experience in industrial automation use cases using computer vision ai certification in ai / data analytics / deep learning is desired having a personal github account will be an advantage. analytical capabilities to support engineering decisions. experience in real-time video analytics pipeline. drone based data analytics and modeling for anomaly detection. process or power industry experience is desired. good in documentation practices, writing reports and project protocols. high level of technical aptitude microsoft office and technical presentation skills. b.s., m.s. in (computer science, electronic / electric engineer)",2024-06-26
Chalhoub Group,8378f131c9896ac4,Stylist – Luxury Technology Boutique,Riyadh,,30+ days ago,30,4.2,[],[],[],https://careers.chalhoubgroup.com/jobs/3789414-stylist-luxury-technology-boutique,https://indeed.com/cmp/Chalhoub-Group,[],"['passion', 'communication', 'team player', 'communication skills', 'integrity', 'responsible', 'leadership', 'flexibility']",[],[],"job summary dyson retail is different, for a number of reasons. firstly, this is a firm of expert engineers, offering people the chance to connect with technology in store, including a world-class styling experience with a blow-out bar concept. we are delivering a high service experience for our shoppers – think 5 star hotel levels of service – demonstrating the value of the technology and providing aftersales care. our aim is to support owners in getting the best out of their dyson technology. this is a new retail concept in a fundamentally entrepreneurial, start-up feeling business. this means that everyone in-store needs to be prepared to do anything and everything required running the business and providing the best customer experience. the main purpose of the role is to deliver outstanding retail experiences that fascinate shoppers through the presentation and demonstration of our machines, whilst talking about the science of hair. reporting in to the senior store manager our stylists is responsible for appointment booking and styling sessions. specific tasks &amp; duties: approaching consumers in a highly competitive retail space, generating interest and sales demonstrating our technology, whilst talking about the science of hair in an everyday language customer deliver the balance between sales and service drive an audience first approach by enhancing personalisation, “vip” experiences and new propositions provide outstanding experiences to establish dyson as a leader in the haircare industry ensuring a high standard of visual merchandising in your area blow-drying and styling sections of the customer’s hair providing guidance on hair care techniques and supporting items manage daily, weekly bookings and find creative ways to increase the number of bookings be the brand guardian, ensuring you know what needs and how to do it in the dyson way skills knowledge and experience: preferably qualified stylist that has experience within the blow dry sector previous experience working with / in a premium beauty brand fluent in english &amp; local market languages track record for creating innovative solutions that solve problems and/or challenge convention be prepared to hit targets great customer-facing and sales skills, including the ability to adapt your style to the needs of every customer previous experience in a promotional marketing and sales background be confident in giving in-depth bespoke consultations for every customer’s styling questions person specification: demonstrates integrity in all their decisions and actions excellent communication skills up to leadership level proven ability to simplify the complex creative and innovative – able to think differently have a passion for technology and hair science passionate about delivering perfect brand and product experiences pro-active – prepared with solutions and anticipating problems passion for learning and keeping up to date with the latest trends team player, happy to share knowledge and experience with people in the team flexibility to operate in an entrepreneurial environment",2024-06-26
Aspen Technology,e035baeaf8ac9cad,Sr Consultant Engineer,Saudi Arabia,Full-time,30+ days ago,30,,['5-8'],[],['bachelor'],https://aspentech.wd5.myworkdayjobs.com/en-US/aspentech/job/Saudi-Arabia/Sr-Consultant-Engineer_R5877,https://indeed.com/cmp/Aspen-Technology-1,"['vba', 'tableau', 'python', 'power bi']","['analytical skills', 'analysis', 'passion', 'communication', 'professional', 'discipline', 'project management', 'communication skills', 'responsible', 'design', 'flexibility', 'responsibility', 'organization']","['big data', 'machine learning', 'data integration', 'project management']","['Big Data', 'Python', 'Analytics', 'BI', 'Data Science', 'R', 'Machine Learning']","the driving force behind our success has always been the people of aspentech. what drives us, is our aspiration, our desire and ambition to keep pushing the envelope, overcoming any hurdle, challenging the status quo to continually find a better way. you will experience these qualities of passion, pride and aspiration in many ways — from a rich set of career development programs to support of community service projects to social events that foster fun and relationship building across our global community. the role we are looking for a sr. consultant engineer to join our asset performance management (apm) team at aspen technology. this role would be part of our professional services organization based in saudi. the main responsibility would be to provide consulting services within the apm portfolio of products focused on reliability, availability, and maintainability (ram) analysis and modeling. modeling will consist primarily of applying aspentech’s discrete-event simulation software to provide business value to clients. the successful applicant is expected to lead a small team per project and is responsible for the project’s technical success. competency in real time relational databases such as ip.21, process data historians, data analytics, a general understanding of holistic nature of integrated process units, utilities, supply chain and general knowledge of rotating assets, such as, compressors, motors, pumps, turbine is expected. this is a unique position for an exceptional engineer to work on project implementations, working closely with our business customers and travelling to their locations from time to time. this is also a very creative role that contributes to the creation and improvement of internal processes and tools to meet customer’s needs. your impact deliver consulting services including solutions architecture &amp; design, implementation, training, and advisory services in supporting client’s use of aspen fidelis modeling software and other apm products. design and configure model-based decision support systems and data integration with external systems and databases. co-ordinate solution delivery in concert with aspentech project management and the client, to ensure projects achieve stated milestones, delivery dates and financial goals. maintain and extend client satisfaction levels and develop opportunities for additional services. work with different departments internally to achieve project implementation excellence and success. what you'll need bachelor’s degree in any of the following engineering areas: chemical, industrial, reliability, mechanical, electronic (focused on process control automation), or similar technically focused degree. 5-8 years’ experience in process control, equipment maintenance and/or reliability in oil &amp; gas, chemical, and/or petrochemical industries. strong understanding of performing reliability, availability, and maintainability (ram) analysis, along with experience with one or more ram modeling software, e.g., titan, fidelis (preferred) programming skills with one or more of vb.net, vba, c++, c# are recommended. strong understanding of chemical economics, and ability to interact with customers about plants, processes, and manufacturing economics. advanced english language level. experience in power bi, tableau or other dashboard platforms are considered a plus. programming in python, r, big data are considered a plus. data analytic experience is mandatory. knowledge in data science areas or specializations are considered a plus. familiarity with machine learning technologies is desirable. self-discipline and motivation to produce results with remote supervision. excellent communication skills. outstanding problem solving and analytical skills. great organizational skills. ability to work in a very fast paced environment. experience working with teams remotely. flexibility to work with clients in different times zone in order to collaborate with colleagues and stakeholders that have a global presence.",2024-06-26
Arabic Computer Systems,e1337d48be917b54,AI Engineer,Riyadh,Full-time,30+ days ago,30,3.3,[],[],[],https://apply.workable.com/j/20258EC5AF,https://indeed.com/cmp/Arabic-Computer-Systems,"['scikit-learn', 'keras', 'python', 'pytorch', 'tensorflow']","['communication', 'communication skills', 'research', 'design', 'problem-solving']","['statistics', 'data modeling', 'transform', 'machine learning', 'ml', 'problem-solving skills', 'deep learning']","['Statistics', 'Python', 'Keras', 'TensorFlow', 'Deep Learning', 'PyTorch', 'Scikit-learn', 'Data Science', 'R', 'Machine Learning']","we are looking for an ai engineer to help us create artificial intelligence products. ai engineer responsibilities include creating machine learning and deep learning models and retraining systems. to do this job successfully, you need exceptional skills in statistics and programming. if you also have knowledge of data science and software engineering, we’d like to meet you. your ultimate goal will be to shape and build efficient self-learning applications. responsibilities study and transform data science prototypes design machine and deep learning systems research and implement appropriate ml/dl algorithms and tools develop machine and deep learning applications according to requirements select appropriate datasets and data representation methods run machine learning tests and experiments fine-tuning using test results train and retrain systems when necessary extend existing ml/dl libraries and frameworks keep abreast of developments in the field requirements proven experience as an ai engineer or similar role understanding of data structures, data modeling, and software architecture ability to write robust code in python and r familiarity with machine learning frameworks (like keras or pytorch or tensorflow) and libraries (like scikit-learn) excellent communication skills ability to work in a team outstanding analytical and problem-solving skills benefits health care plan paid time off training &amp; development",2024-06-26
Microsoft,efe5602ca4adb8c7,Cloud Solution Architect - Azure AI and Machine Learning,Saudi Arabia,Full-time,30+ days ago,30,4.2,[],[],['bachelor'],https://careers.microsoft.com/us/en/job/1704509/Cloud-Solution-Architect---Azure-AI-and-Machine-Learning?jobsource=indeed&utm_source=Job Board&utm_campaign=indeed-feed,https://indeed.com/cmp/Microsoft,"['azure', 'java', 'cloud', 'kubernetes', 'python', 'docker']","['communication', 'collaboration', 'accountability', 'communication skills', 'integrity', 'responsible', 'design', 'organization']","['cloud', 'kubernetes', 'machine learning', 'ml', 'nlp']","['NLP', 'Azure', 'Python', 'Machine Learning']","with over 18,000 employees worldwide, the microsoft customer experience &amp; success (ce&amp;s) organization is responsible for the strategy, design, and implementation of microsoft’s end-to-end customer experience. come join ce&amp;s and help us build a future where customers come to us not only because we provide industry-leading products and services, but also because we provide differentiated and connected customer experience. the global customer success (gcs) organization is leading the effort to create the desired customer experience through support offer creation, driving digital transformation across our tools, and delivering operational excellence across ce&amp;s. as a cloud solution architect aligned to the azure ai platform for microsoft's customer experience &amp; success (ce&amp;s) organization, you will enable customers to achieve their outcomes based on their investments in microsoft technology. leveraging your microsoft azure artificial intelligence (ai) and machine learning (ml) technical subject matter expertise, you will lead technical conversations with customers and microsoft colleagues, driving value to their organization. this is a hands-on role that includes accelerating customer adoption by building generative ai solutions and identifying resolutions to unblock customer success projects. you will also drive product influence with engineering through technical feedback and increase technical intensity with the field teams. this opportunity will allow you to accelerate your career growth, honing your technical and collaboration skills, and deepening your cloud expertise. the microsoft customer experience &amp; success (ce&amp;s) organization is responsible for the strategy, design, and implementation of microsoft’s end-to-end customer experience. come join ce&amp;s and help us build a future where customers come to us not only because we provide industry-leading products and services, but also because we provide differentiated and connected customer experience. microsoft’s mission is to empower every person and every organization on the planet to achieve more. as employees we come together with a growth mindset, innovate to empower others and collaborate to realize our shared goals. each day we build on our values of respect, integrity, and accountability to create a culture of inclusion where everyone can thrive at work and beyond. responsibilities accelerate new customer opportunities from proof of concept (poc) to production for azure ai workloads such as azure openai, azure cognitive search, and azure machine learning provide customers with generative ai expertise and advisory through architecture designs, proof of concepts, production reviews, and post-sales support. expand and grow azure ai adoption for existing customer base. lead and provide guidance in technical escalations to unblock ai customers in collaboration with microsoft stakeholders. provide expert perspective to key stakeholders to increase platform adoption through customer insights &amp; feedback on a regular basis. drive product improvement and influence roadmap with engineering through deep technical insights. increase ai technical intensity in the field through upskilling, sharing best practices, and scaling repeatable ip other: embody our culture and values qualifications required/minimum qualifications bachelor’s degree in computer science, information technology, engineering, business, or related field and proven years’ experience in cloud/infrastructure technologies, information technology (it) consulting/support, systems administration, network operations, software development/support, technology solutions, practice development, architecture, and/or consulting or equivalent experience. proven years’ experience with enterprise-scale technical delivery experience with azure ai services including azure openai, azure cognitive search, azure speech, azure machine learning (or equivalent), generative ai, llm customization, nlp, search, mlops, open-source ai frameworks, ai infrastructure, architecture design. proven years’ experience creating ai proof of concepts and minimum viable products (mvps) and supporting production deployments. additional or preferred qualifications breadth of technical experience and knowledge (preferred): application development skills – proficient with python, java, or similar programming languages in the context of application development, and ability to integrate azure ai with other services; cloud application deployment experience with services such as azure functions, kubernetes, docker, api management, and related. architecture design – the ability to create and explain 3-tier architecture diagrams, system context diagrams, system interaction diagrams, etc. experience in architecting deployments for production in an enterprise setting including infrastructure knowledge, security, networking, and other considerations. proven years’ experience working on technical projects in a customer-facing role (e.g., internal and/or external) ability to build relationships, orchestrate, lead, and influence virtual teams, ensuring successful acceleration and unblocking of customer projects. technical certification in cloud (e.g., azure, amazon web services, google, security certifications) presentation and communication skills with a high degree of comfort with key audiences (senior executives, management, data scientists, engineers, etc.) microsoft is an equal opportunity employer. consistent with applicable law, all qualified applicants will receive consideration for employment without regard to age, ancestry, citizenship, color, family or medical care leave, gender identity or expression, genetic information, immigration status, marital status, medical condition, national origin, physical or mental disability, political affiliation, protected veteran or military status, race, ethnicity, religion, sex (including pregnancy), sexual orientation, or any other characteristic protected by applicable local laws, regulations and ordinances. if you need assistance and/or a reasonable accommodation due to a disability during the application process, read more about requesting accommodations.",2024-06-26
