name,key,title,location,jobType,posted,days_ago,rating,experience,salary,education,feed,link,Tools,Soft Skills,Industry Skills,Data Jobs Keywords,description,date
IBM,289ec8c20bc8ffa0,Full Stack Developer,Riyadh,,25 days ago,25,3.9,['5+'],[],[],https://click.appcast.io/track/jo3rlkm-org?cs=hqw,https://indeed.com/cmp/IBM,"['sql', 'cloud', 'javascript', 'sql server']","['analysis', 'reliable', 'motivated', 'confidence', 'professional', 'ownership', 'resilient', 'responsible', 'design', 'responsibility', 'innovation']","['transform', 'cloud', 'machine learning']","['SQL', 'Machine Learning']","introduction the ibm sustainability software business unit is seeking talented and motivated software developers to work as a full stack developer on the envizi esg suite of products. your role and responsibilities the ibm sustainability software business unit is seeking talented and motivated software developers to work as a full stack developer on the envizi esg suite of products. in this role, you will be responsible for enhancing &amp; building new product capabilities including integration into the cloud service environment. you'll closely collaborate with the broader product management, design, development &amp; support team using scrum agile methodology. this is an exciting opportunity to contribute to ibm's envizi esg suite and help removes barriers to accelerating sustainability performance through the capture, consolidation, management, analysis and reporting on environmental, social and governance data. emaiwd24 sasw_24 required technical and professional expertise 5+ years experience : developing of data retrieval stored procedures using sql server or equivelent experience with c# and .net 4.5 or later experience in front-end development using javascript frameworks, html, typescript, css be involved and take ownership of end-to-end delivery - from solution design, estimation, development, testing and deployment uphold quality standards including reliability, efficiency, security, maintainability and usability by applying best practice processes, methodologies and tools contribute to the design and build evolution of the platform, ensuring it remains scalable, reliable, and easy to use contribute to engineering discussions across our platform collaborate with product managers, ux designers, engineers and qa to design, develop and deploy new platform features and functionality for our saas product preferred technical and professional expertise experience working with ibm maximo and tririgra or similar products in the asset &amp; building management domain about business unitibm software infuses core business operations with intelligence—from machine learning to generative ai—to help make organizations more responsive, productive, and resilient. ibm software helps clients put ai into action now to create real value with trust, speed, and confidence across digital labor, it automation, application modernization, security, and sustainability. critical to this is the ability to make use of all data, because ai is only as good as the data that fuels it. in most organizations data is spread across multiple clouds, on premises, in private datacenters, and at the edge. ibm’s ai and data platform scales and accelerates the impact of ai with trusted data, and provides leading capabilities to train, tune and deploy ai across business. ibm’s hybrid cloud platform is one of the most comprehensive and consistent approach to development, security, and operations across hybrid environments—a flexible foundation for leveraging data, wherever it resides, to extend ai deep into a business. your life @ ibmin a world where technology never stands still, we understand that, dedication to our clients success, innovation that matters, and trust and personal responsibility in all our relationships, lives in what we do as ibmers as we strive to be the catalyst that makes the world work better. being an ibmer means you’ll be able to learn and develop yourself and your career, you’ll be encouraged to be courageous and experiment everyday, all whilst having continuous trust and support in an environment where everyone can thrive whatever their personal or professional background. our ibmers are growth minded, always staying curious, open to feedback and learning new information and skills to constantly transform themselves and our company. they are trusted to provide on-going feedback to help other ibmers grow, as well as collaborate with colleagues keeping in mind a team focused approach to include different perspectives to drive exceptional outcomes for our customers. the courage our ibmers have to make critical decisions everyday is essential to ibm becoming the catalyst for progress, always embracing challenges with resources they have to hand, a can-do attitude and always striving for an outcome focused approach within everything that they do. are you ready to be an ibmer? about ibmibm’s greatest invention is the ibmer. we believe that through the application of intelligence, reason and science, we can improve business, society and the human condition, bringing the power of an open hybrid cloud and ai strategy to life for our clients and partners around the world.restlessly reinventing since 1911, we are not only one of the largest corporate organizations in the world, we’re also one of the biggest technology and consulting employers, with many of the fortune 50 companies relying on the ibm cloud to run their business. at ibm, we pride ourselves on being an early adopter of artificial intelligence, quantum computing and blockchain. now it’s time for you to join us on our journey to being a responsible technology innovator and a force for good in the world. location statementfor additional information about location requirements, please discuss with the recruiter following submission of your application. being you @ ibmibm is committed to creating a diverse environment and is proud to be an equal-opportunity employer. all qualified applicants will receive consideration for employment without regard to race, color, religion, sex, gender, gender identity or expression, sexual orientation, national origin, caste, genetics, pregnancy, disability, neurodivergence, age, veteran status, or other characteristics. ibm is also committed to compliance with all fair employment practices regarding citizenship and immigration status.",2024-06-26
Shaguf,f2b64af70404037c,Senior AI Engineer,Riyadh,,27 days ago,27,,['5+'],[],"['master', 'bachelor']",https://shaguf.jobsoid.com/j/83313/senior-ai-engineer?source=indeed,https://indeed.com/cmp/Shaguf,"['azure', 'cloud', 'python', 'aws', 'llms']","['collaborative', 'commitment', 'professional', 'continuous learning', 'design', 'research']","['google cloud', 'cloud', 'machine learning', 'ml', 'llms', 'nlp', 'natural language processing']","['Natural Language Processing', 'AWS', 'Python', 'NLP', 'Azure', 'R', 'Machine Learning']","about bites: bites is an innovative genai app transforming the way students learn by converting their learning material into interactive, personalized, and bite-sized learning content. in just 9 months, bites has reached over 700,000 students and is on track to reach millions more. our product has generated hundreds of millions of outputs, underscoring our commitment to delivering high-quality educational content. we are looking for a passionate and experienced senior ai engineer to join our dynamic team. this role is pivotal in advancing our ai capabilities to deliver a more personalized and efficient learning experience for our users. key responsibilities: lead the r&amp;d of our ai features to enhance the performance of our models and build different learning modes. design and build machine learning models to improve content quality, personalization, and customization features. collaborate with product managers, designers, and developers to understand user needs and translate them into ai solutions. optimize and maintain our current ai infrastructure to ensure scalability and performance. conduct research to stay up-to-date with the latest advancements in ai and machine learning technologies. mentor and guide junior ai engineers, fostering a culture of continuous learning and improvement. qualifications: bachelor’s or master’s degree in computer science, artificial intelligence, machine learning, or a related field. 5+ years of experience in ai and machine learning, with a proven track record of developing and deploying ai models in production. experience with large language models (llms) and their applications in generating and enhancing educational content. strong programming skills in python and proficiency with ml frameworks. experience with natural language processing (nlp) and optical character recognition (ocr) technologies. familiarity with cloud platforms (e.g., microsoft azure, aws, google cloud) and deploying ai solutions in a cloud environment. why join bites? be part of a mission-driven company focused on revolutionizing education through technology. work in a collaborative and inclusive environment with a passionate and innovative team. opportunities for professional growth and development. competitive salary and benefits package. job type: full-time, remote. ready to shape the future of education? apply now and be a part of the bites journey!",2024-06-26
SAP,ad38d02f1af6bd82,SAP Young Professionals Program KSA 2024,Riyadh,,29 days ago,29,4.2,['3'],[],['bachelor'],https://jobs.sap.com/job/Riyadh-SAP-Young-Professionals-Program-KSA-2024-11435/1076718801/?feedId=118200&utm_source=Indeed&utm_campaign=SAP_Indeed,https://indeed.com/cmp/SAP,"['cloud', 'sap']","['analysis', 'coaching', 'commitment', 'initiative', 'planning', 'responsible', 'design', 'innovation']","['cloud', 'machine learning']","['Data Science', 'Analytics', 'Optimization', 'Machine Learning']","company description sap started in 1972 as a team of five colleagues with a desire to do something new. together, they changed enterprise software and reinvented how business was done. today, as a market leader in enterprise application software, we remain true to our roots. that’s why we engineer solutions to fuel innovation, foster equality and spread opportunity for our employees and customers across borders and cultures. the sap young professionals program the sap young professionals program is a free initiative delivered by the digital skills center of sap. the program, which lasts for 2 months, is designed to give recent graduates the certifications and soft skills required to begin a career as an sap associate consultant. at the end of the training, sap will work very closely with the program graduates to introduce them to a host of opportunities with sap customers and partners to work as an sap consultant. sap consultants the role of an sap consultant can be divided into 2 functions: functional and technical. the consultant will contribute to blueprinting, design, implementation, operation, optimization, and upgrade phase of a s/4 hana project, and provide business process as well as functional expertise, and project guidance to our clients to ensure their investment in sap software and consulting services will make their business the best run business. the consultant is also responsible for maintaining a high degree of customer satisfaction in each of their accounts in addition to growing and developing referenceable customers through their investigation, analysis, consulting, coaching, knowledge transfer, and relationship-building efforts. certificate information: sap s/4hana cloud is a complete enterprise resource planning (erp) system with built-in intelligent technologies, including ai, machine learning, and advanced analytics. it helps companies adopt new business models, manage business change at speed, orchestrate internal and external resources, and use the predictive power of ai. benefit from tight, native integration between processes, industry depth, and a consistent in-memory data model. sap business technology platform (sap btp) brings together data management, analytics, artificial intelligence, application development, automation, and integration in one, unified environment. sap business technology platform is a unified, business-centric, and open platform for the entire sap ecosystem, enabling users to integrate and create value from data and extend their sap and third-party solution landscapes to meet evolving business needs. how you benefit: start your journey to become an sap consultant; gain globally-recognised associate-level sap certifications; learn directly from sap experts; experience classroom and workshop-based training in sap technologies; develop the soft skills needed to prepare you for successful job applications; benefit from introductions to job opportunities within the sap ecosystem to help secure a position after the training. please note this program does not guarantee you a job at the end of it. what we require from a candidate: candidates must have the legal right to work in ksa. candidates must be currently unemployed or employed in a part time/non-permanent role not related to career aspirations; candidates must be educated to at least bachelor level in a field related to business administration / management information systems / engineering / or information technology / data science / computer science candidates will preferably have graduated within the last 3 years with a gpa in the top quartile – proof of this may be requested. candidates must have a keen interest in starting an sap-related career involving travel; candidates should be fluent in english, both written and spoken; the program will commence by late july 2024 and full-time availability from 9am – 6pm from sunday - thursday throughout the training period is essential. the program will last for 2 months. this training will take place online in a virtual live classroom format. please ensure you have strong enough internet at home to be able to participate in this program. please share an english version of your resume while applying for this program. sap's diversity commitment to harness the power of innovation, sap invests in the development of its diverse employees. we aspire to leverage the qualities and appreciate the unique competencies that each person brings to the company. sap is committed to the principles of equal employment opportunity and to providing reasonable accommodations to applicants with physical and/or mental disabilities. if you are in need of accommodation or special assistance to navigate our website or to complete your application, please send an e-mail with your request to recruiting operations team: careers@sap.com successful candidates might be required to undergo a background verification with an external vendor. for sap employees: only permanent roles are eligible for the sap employee referral program, according to the eligibility rules set in the sap referral policy.",2024-06-26
aramcoservices,4c01a8b9893f9fe4,Generative AI Expert,Saudi Arabia,,30+ days ago,30,,['5+'],[],['master'],https://careers.aramco.com/expat_us/job/Generative-AI-Expert/853510523/,https://indeed.com/cmp/Aramcoservices,['python'],"['analysis', 'reliable', 'focus', 'passion', 'commitment', 'communication', 'collaboration', 'discipline', 'professional', 'decision making', 'coordination', 'responsible', 'design', 'responsibility', 'organization', 'innovation']","['data analysis', 'machine learning', 'ml', 'nlp', 'deep learning']","['Python', 'NLP', 'Deep Learning', 'Data Analysis', 'Data Science', 'Machine Learning']","job req id: 13968 description: aramco energizes the world economy. aramco occupies a unique position in the global energy industry. we are the world's largest producer of hydrocarbons (oil and gas), with the lowest upstream carbon intensity of any major producer. with our significant investment in technology and infrastructure, we strive to maximize the value of the energy we produce for the world along with a commitment to enhance aramco’s value to society. headquartered in the kingdom of saudi arabia, and with offices around the world, we combine market discipline with a generations’ spanning view of the future, born of our nine decades experience as responsible stewards of the kingdom’s vast hydrocarbon resources. this responsibility has driven us to deliver significant societal and economic benefits to not just the kingdom, but also to a vast number of communities, economies, and countries that rely on the vital and reliable energy that we supply. we are one of the most profitable companies in the world, as well as amongst the top five global companies by market capitalization. overview aramco seeking a brilliant and results-driven generative ai expert to join the technology &amp; digital coordination team within its hr &amp; corporate services (hr&amp;cs) business, and shape the future of technology in corporate services sector. this critical role will be responsible for driving cutting-edge generative ai initiatives, tackling complex problems, and providing advice to decision makers in an advisor capacity. hr&amp;cs’ business is a diverse and manpower-intensive organization with 15,000+ employees. our suborganizations vary in nature, and include: human resources, training &amp; development, safety &amp; security, government affairs, public affairs, community services, transportation (marine, aviation, etc.), and medical services support. as our ai expert, you'll play a pivotal role in working with cross-functional teams to develop, implement and drive the hr&amp;cs ai strategy. key responsibilities define and implement the hr&amp;cs ai roadmap, identifying opportunities for ai integration across the business line. work across organizations on the ideation, scoping and implementation of the best suited generative ai solutions to addresses their needs. advise and support stakeholders, applying generative ai methodologies within their business to improve performance and enable data-driven decision making. design and develop solutions that use generative ai, built on machine learning (ml) and large language models (llm), tailored to business need. fine-tune generative ai models using the most efficient algorithms, focusing on delivering optimal outcomes. build teams to develop and support generative ai, and upskill them as needed. work effectively with engineers, data scientists, product managers, and other stakeholders. clearly explain complex technical concepts to both technical and non-technical audiences. continuously learn and stay current with the latest advancements in ai. minimum requirements master's degree in computer science, data science, machine learning, or a related field with a strong focus on artificial intelligence. 10+ year of work experience in digital technology field with at least 5+ years of experience in developing and deploying ai models. preferably acquiring generative ai professional certification, deep gen ai certification or equivalent. experience in designing and implementing generative ai models. highly qualified in programming ai related languages like python and other ai frameworks. highly understands deep learning architecture, machine learning, nlp and generative models. experience in dealing with data (data analysis, manipulation, processing and augmentation). excellent communication and collaboration skills. ability to translate technical concepts in non-technical, presentable format. passion for innovation and a desire to make a real-world impact with ai. working environment our high-performing employees are drawn by the challenging and rewarding professional, technical and industrial opportunities we offer, and are remunerated accordingly. at aramco, our people work on truly world-scale projects, supported by investment in capital and technology that is second to none. and because, as a global energy company, we are faced with addressing some of the world’s biggest technical, logistical and environmental challenges, we invest heavily in talent development. we have a proud history of educating and training our workforce over many decades. employees at all levels are encouraged to improve their sector-specific knowledge and competencies through our workforce development programs – one of the largest in the world. country/region: sa",2024-06-26
