Company ID,Company Name,Name from URL,Description,Company Size,City,State,Country,Business Category,Founded at (Date),IPO status,E-mail,Phone:,Linkedin,Facebook,Twitter,Funding Rounds,Funding Total (USD),Acquisitions,Investments,Lead Investments,Investors,Lead Investors,Total Products Active,Active Tech Count,Monthly Visits,Monthly Visits Change(%),Similar Companies
43675e18-a9c9-4156-acbc-065b36676d90,Sweater,sweater,"Sweater is a fintech company building the first fully-managed venture capital fund that is open to everyday investors.
Our mobile-first experience allows you direct access to the world's most exclusive asset class—Venture Capital. Sweater’s mission is to empower everyone to become investors in the next generation of venture-backed startups.

Every founder should be able to build their vision, and every person should be able to take part in the founder journeys that create the next generation of influence and wealth.",,,,,"['Financial Services', 'FinTech', 'Venture Capital']",2019-01-01,,team@sweaterventures.com,,https://www.linkedin.com/company/sweaterventures/,https://www.facebook.com/sweaterventures,https://twitter.com/sweaterventures?lang=en,3.0,14300000.0,[],"['EarlyBird', 'Hearth', 'Guest House', 'Pear Suite', 'SweatPals', 'Grapefruit Health', 'Wyndly', 'After.com', 'Shappi', 'IsoTalent']",2.0,"['Kickstart', 'Eli Broverman', 'Nick Perez', 'Litquidity Capital', 'Monsen Ventures', 'Aaron Wolko', 'Bison Venture Partners', ""Nate O'Brien"", 'Jeff Cruttenden', 'Spacestation Investments']",2.0,,27.0,2376.0,18.5,"['Stonepeak', 'Rainmatter Capital', 'Orange DAO', 'Horizon Technology Finance', 'Digital Currency Group', 'DigniFi', 'Blockchain Founders Fund', 'Pluto', 'Redbeard Ventures', 'Endeavor']"
dc7b62e8-d060-7f7b-8c76-48e300a22476,Itineris,itineris,"Itineris develops and implements UMAX, a cloud-based CIS & CRM solution specifically designed for Utilities. 

UMAX leverages workflow automation and AI to easily manage everything from meter to cash, advanced revenue collection, assets, complex rates, conservation, marketing and campaign programs, and much more to ensure advanced customer engagement and streamlined business processes. UMAX is developed on the powerful Microsoft Dynamics 365 platform, and is delivered as a service in the Microsoft Azure Cloud. 

Founded in 2003, Itineris has an impressive implementation track record. Our customer base includes De Watergroep (Belgium), Eneco (the Netherlands), SSE (UK), Flogas (Ireland), The New York Department of Environmental Protection (US), Boston Water and Sewer Commission (US), and the City of Tallahassee (US), to name a few.

With our software solutions, we want to empower utility professionals to play their part in the new world of energy and water.",c_00251_00500,Sint-denijs-westrem,Oost-Vlaanderen,Belgium,"['Business Information Systems', 'Clean Energy', 'CRM', 'Energy', 'Enterprise Software', 'Information Technology', 'Power Grid', 'Software']",2003-01-01,private,contact@itineris.net,+32 9 386 01 02,http://www.linkedin.com/company/itineris,http://www.facebook.com/itineris.umax,http://twitter.com/ITINERIS_NET,4.0,49920965.0,['Opinum'],[],,"['Alychlo', 'Gimv', 'Gimv', 'Edgard Vermeersch']",2.0,15.0,52.0,3733.0,177.34,"['Utilidata', 'Teamwork', 'Anchore', 'Talon.One', 'RD Station', 'GASTROFIX', 'MilkCrate', 'Infovista']"
7c0ccf2a-788f-43a3-9e57-8af6f88a278b,Allianz Partners,allianz-partners,"Allianz Partners is an insurance company. Their services include assistance, health and life, automotive, and travel insurance services. Their in-house data lab provides customer behavior and psychographic services.",c_10001_max,Saint-ouen,Ile-de-France,France,"['Finance', 'Financial Services', 'Insurance']",1890-01-01,private,help@allianz.com,+33 1 53 25 53 25,https://www.linkedin.com/company/allianz-partners,https://www.facebook.com/AllianzAssistance,https://twitter.com/allianzpartners,,,[],[],,[],,12.0,,33782.0,2.99,"['Ameriprise Financial', 'State Farm', 'Bank of Baroda', 'Akbank', 'Bank of Ireland', 'SILAC Insurance Company', 'StanCorp Financial', 'Die Vienna Insurance Group', 'Generali Česká pojišťovna', 'SV SparkassenVersicherung']"
aa563215-3b80-a140-7726-fe2859803a16,Unifonic,unifonic,"Unifonic  is a leading cloud-based customer communication and engagement solutions (CPaaS)  provider in the MENA region that empowers organizations to engage seamlessly with their customers.
Since it was founded in 2006, Unifonic has consistently developed its product line and its markets to provide an affordable enterprise-grade multilingual, seamless omnichannel communications platform throughout the Middle East.",c_00251_00500,Riyadh,Ar Riyad,Saudi Arabia,"['Cloud Computing', 'Information Technology', 'Messaging', 'PaaS', 'SaaS', 'SMS']",2006-01-01,private,sales@unifonic.com,+966920002687,https://www.linkedin.com/company/unifonic/,https://www.facebook.com/unifonic,https://www.twitter.com/unifonic,2.0,146000000.0,['SESTEK'],[],,"['Riyad TAQNIA Fund (RTF)', 'Highgoal Capital', 'Sanabil', 'Riyad Bank', 'SoftBank Vision Fund', 'STV', 'Riyad TAQNIA Fund (RTF)', 'Endeavor Catalyst', 'Elm', 'STV']",3.0,31.0,32.0,66576.0,-50.25,"['Route Mobile', 'Noogata', 'Sleeknote', 'Nvoip', 'Ujuzi Craft', 'e.Ocean', 'NXCLOUD', 'Qfast.co']"
c9310fd0-d888-4e14-b774-2201e96afc1f,Bupa Arabia,bupa-arabia,Bupa Arabia is an international healthcare group which offers health insurance and medical subscription products.,,,,,"['Health Care', 'Health Insurance', 'Insurance']",1997-01-01,,sales@bupa.com.sa,966 800 244 0307,https://www.linkedin.com/company/bupaarabia/,https://www.facebook.com/bupaarabia/,https://twitter.com/BUPAArabia,,,[],['Okadoc'],,[],,17.0,25.0,1363545.0,51.04,"['Wafa Insurance', 'Ehealthscanner', 'Morgan Price']"
fc5fbe7a-562d-d577-b05e-46797caa134c,IBM,ibm,"IBM is a technology and innovation company that offers a wide range of technology and consulting services; a broad portfolio of middleware for collaboration, predictive analytics, software development, and systems management.",c_10001_max,Armonk,New York,United States,"['Business Development', 'Business Information Systems', 'CRM', 'Data Management', 'Software']",1911-06-06,public,ews@us.ibm.com,(914)499-1900,https://www.linkedin.com/company/ibm,https://www.facebook.com/IBM,http://twitter.com/IBM,,,"['SiXworks', 'Skyarch Networks', 'HashiCorp', 'Pliant.io', 'webMethods', 'StreamSets', 'Manta', 'Apptio', 'Polar Security - an IBM Company', 'Ahana']","['Cohesity', 'Ghost Kitchens', 'Portal', 'Hugging Face', 'The University of Tokyo', 'University of Chicago', 'TechZig', 'NetBox Labs', 'Strangeworks', 'NetBox Labs']",20.0,[],,171.0,79.0,25938820.0,-1.99,"['SendGrid', 'Koridor', '66degrees', 'HKW', 'iTOTEM Analytics', 'RIVA', 'Inventa B-Corp', 'Axiom', 'Syncsort', 'IBM Security Services']"
568b48b2-3f1e-4bd9-6921-b6d2e712fd20,McKinsey & Company,mckinsey-company,"McKinsey & Company is a global management consulting firm, the trusted advisor to the world's leading businesses, governments, and institutions. 

McKinsey & Company provides solutions for issues of concern to senior management in large corporations and organizations. It provides advisory services to the world's leading businesses, governments, and institutions. It also provides industry practice solutions and functional practice solutions. Its industry practice solutions include advanced electronics, chemicals, metal and mining, electrical power, consumer goods, and more. Its functional practice solutions include business technology, corporate finance and sales, operations, and other related areas. 

McKinsey & Company was established in 1926 and is based in London, United Kingdom. It operates additional offices on each continent. When James O. McKinsey founded McKinsey in 1926, he could not have imagined the reach his small firm would eventually have. Eighty-seven years later, the firm has grown into a global partnership serving two-thirds of the Fortune 1000.",c_10001_max,New York,New York,United States,"['Consulting', 'Management Consulting', 'Professional Services']",1926-01-01,private,,+43-(212) 446-7000,https://www.linkedin.com/company/mckinsey/,http://www.facebook.com/mckinsey,http://twitter.com/McKinsey,,,"['Strategic Estimating Systems', 'Iguazio', 'SCM Connections', 'Caserta', 'Solutions for Growth Consulting', 'IncepTech', 'Material Economics', 'Vivid Economics', 'Hypothesis', 'Venturetec']","['Shiprocket', 'MediaGlobe', 'Holidoit', 'Upstreet', 'Praetorian', 'Element AI', 'Tjori', 'Bohemian Birds Group', 'Equippo.com', 'Bombay Shaving Company']",5.0,[],,62.0,96.0,5914850.0,-9.83,"['Techstars', 'Prophet', 'CBIZ', 'The Caldwell Partners', 'LMI', 'Capita', 'Bain & Company', 'The Boston Consulting Group', 'Kearney', 'Nityo Infotech Services']"
873fb633-b62d-4106-8304-5a42e68a5524,ITT,itt,ITT Cannon is a design and manufacture of highly engineered harsh-environment connector and interconnect solutions company.,c_01001_05000,Weinstadt-endersbach,Baden-Wurttemberg,Germany,"['Electronics', 'Manufacturing', 'Product Design']",1915-01-01,private,sales.germany@coactive-tech.com,49 30 439990,https://www.linkedin.com/company/itt-cannon/,https://www.facebook.com/ITTInc/?fref=ts,https://twitter.com/ITT_Inc,,,[],[],,[],,16.0,33.0,6565.0,38.27,"['Atlas Copco Group', 'Azbil Corporation', 'TCL Communication', 'SOURIAU SAS', 'Detectortesters', 'C3PO, SA', 'Polamco', 'Truck-Lite Europe', 'Unisto', 'HCC Industries, Inc.']"
3af3f638-2a80-e072-add0-8396e130d842,Beyond Limits,beyond-limits,"Beyond Limits is an Industrial and Enterprise-grade AI technology company that covers the full range of Artificial Intelligence, purpose-built for the most demanding sectors, including energy, utilities, and healthcare (as well as finance).  

Beyond traditional artificial intelligence, Beyond Limits has developed powerful Cognitive AI that unifies human knowledge with machine learning techniques.  Its technology provides decision makers with efficient, reliable guidance and clear, understandable recommendations for everyday operational challenges to the most complex, mission-critical situations.

Customers use Beyond Limits AI to drastically boost operational insights, improve operating conditions, enhance performance at every level, and ultimately increase profits as a result.",c_00251_00500,Glendale,California,United States,"['Artificial Intelligence (AI)', 'Energy', 'Health Care', 'Industrial', 'Machine Learning']",2014-01-01,private,sales@beyond.ai,+1 818-643-2344,https://www.linkedin.com/company/beyond-ai,https://www.facebook.com/BeyondLimitsAI/,https://twitter.com/beyondlimitsai,3.0,158500000.0,"['Altec', 'Oak Consulting']",[],,"['BP Ventures', 'G42', 'BP Ventures']",2.0,29.0,49.0,5853.0,32.15,"['Pieces', 'Kebotix', 'HEALTH[at]SCALE Technologies', 'Swoop']"
b6a09bde-184a-a6ed-7d3d-150d5ad95d2f,AECOM,aecom,"AECOM is a global provider of professional technical and management support services to a broad range of markets, including transportation, facilities, environmental, energy, water and government.  With approximately 45,000 employees around the world, AECOM is a leader in all of the key markets that it serves.  AECOM provides a blend of global reach, local knowledge, innovation and technical excellence in delivering solutions that create, enhance and sustain the world's built, natural, and social environments.  A Fortune 500 company, AECOM serves clients in more than 150 countries and had revenue of $8.0 billion during the 12 months ended March 31, 2014.",c_10001_max,Los Angeles,California,United States,"['Civil Engineering', 'Construction', 'Consulting', 'Energy', 'Government', 'Information Technology']",1990-01-01,public,info@aecom.com,9042712899,https://www.linkedin.com/company/aecom/,https://www.facebook.com/AecomTechnologyCorporation/,http://twitter.com/AECOM,,,"['Shimmick Construction', 'ACE International Consultants', 'Hunt Construction Group', 'URS Corporation', 'Capital Engineering Corp.', 'Spectral Services Consultants Pvt. Ltd.', 'RSW', 'Davis Langdon', 'McNeil Technologies', 'Tishman Construction Group']",[],,[],,36.0,124.0,454253.0,5.38,"['Jacobs', 'Kratos Defense and Security Solutions', 'Level Access', 'Feedback Infra', 'Serco', 'Charter Oak Environmental Services', 'Economics Research Associates']"
21125c53-39ee-e735-27a2-a87c25435013,Dexcom,dexcom,"DexCom is a developer of glucose sensing technologies and focuses on these technologies. Founded in 1999, DexCom's roots stem from the pioneering 1967 research on implanted glucose sensors at the University of Wisconsin. DexCom started with a focus on creating an implantable Sensor that the body would not reject and that would perform for a long period of time.",c_05001_10000,San Diego,California,United States,"['Diabetes', 'Health Care', 'Health Diagnostics', 'Medical Device']",1999-01-01,public,techsupport@dexcom.com,(888) 738-3646,https://www.linkedin.com/company/dexcom,https://www.facebook.com/dexcom,https://www.twitter.com/dexcom,8.0,2163689019.0,"['TypeZero Technologies', 'Nintamed', 'SweetSpot Diabetes Care']","['Phenomix Sciences', 'Current Health', 'Beta Bionics']",1.0,"['St. Paul Venture Capital', 'RWI Group', 'Warburg Pincus', 'Canaan Partners', 'Windamere Venture Partners', 'Federated Kaufmann Fund', 'St. Paul Venture Capital', 'Fog City Capital', 'RWI Group', 'Canaan Partners']",1.0,63.0,67.0,3125804.0,33.92,"['Tandem Diabetes Care', 'Intuity Medical', 'Intarcia Therapeutics', 'AgaMatrix', 'Clove', 'Instadiagnostics', 'H2U Corp.', 'Telcare', 'Echo Therapeutics', 'Viora Health']"
e59b7579-6549-6c4d-87ce-2499c8f6bc62,Infosysta,infosysta,"Infosysta is a multi-national Software Integrator & Atlassian Platinum Solution Partner active in EMEA.

Infosysta Experts help medium and enterprise companies (Groups, Banks, Telecom, Airlines, FMCG, Governments,...) in the Digital and Agile Transformation by designing and implementing the best solutions for them.  Infosysta Services focus on solutions providing Agile Project Management, Task Management, Application Lifecycle Management ALM, Software Development LifeCycle Management SDLC, DevOps, ITSM and Service Desk, Content Management, Document Management, Capacity Management, Demand Management, Release Management and much more.",c_00101_00250,Dubai,Dubai,United Arab Emirates,"['Business Information Systems', 'DevOps', 'Enterprise Resource Planning (ERP)', 'Enterprise Software', 'Information Technology', 'Management Information Systems', 'Software', 'Software Engineering']",2012-05-15,private,feras.elhajjar@infosysta.com,971 4 887 5014,https://www.linkedin.com/company/infosysta,https://www.facebook.com/infosysta,https://www.twitter.com/infosystasal,,,[],[],,[],,16.0,61.0,2496.0,77.4,"['Priority Software', 'MilkCrate', 'TravelSkope', 'Moveo Group', 'AMAGI', 'Techfino', 'DevLogic Technologies Pvt Ltd', 'We As Web', 'Gigalabs PVT LTD', 'Business Fitter Fintech LLC']"
8ed6e29f-4f16-41cf-a939-0af0690de094,Master Works,master-works,"MasterWorks assists businesses and technology in collaborating to protect existing data investments and unlock their business value through the use of the most advanced tools, technologies, and methodologies. They specialize in products and services such as data management, artificial intelligence, data strategy, API management, software development, and robotic process automation.",c_00251_00500,Riyadh,Ar Riyad,Saudi Arabia,"['Big Data', 'Business Intelligence', 'Consulting', 'Data Visualization', 'Predictive Analytics', 'Software']",2003-01-01,private,info@master-works.net,+966-114000014,https://www.linkedin.com/company/master-works/,https://www.facebook.com/MasterWorks.sa,https://twitter.com/MasterWorks_SA,1.0,39986415.0,[],[],,['Merak Capital'],1.0,17.0,18.0,,,"['Plotly', 'Prevedere', 'Altinity', 'Databox', 'Blue Yonder', 'Voltaiq', 'Qichacha', 'wisu', 'AcroData', 'Big Data Architect']"
f9ee796b-6458-2647-847d-f8f92fb86647,Lucidya,lucidya,"Lucidya is an Enterprise B2B SaaS company that was founded in 2016 with a headquarter in Riyadh, Saudi Arabia. In a few years, the company managed to scale its customers base from Saudi to more than 6 countries including leading brands in different industries like Telecoms, BFSI, Automotive, FMCG, Retail, and others

Thanks to its unique and proprietary AI & Arabic NLP technologies, Lucidya provides the most accurate analysis of interactions in the Arabic language making Lucidya the #1 tool in its category by users rating in MENA",c_00051_00100,Riyadh,Ar Riyad,Saudi Arabia,"['Analytics', 'Artificial Intelligence (AI)', 'Machine Learning', 'SaaS', 'Social CRM', 'Social Media Management']",2016-01-01,private,see@lucidya.com,+966 11 453 0865,https://www.linkedin.com/company/lucidya,https://www.facebook.com/lucidya,https://twitter.com/lucidya,2.0,7250000.0,[],[],,"['Rua Growth Fund', 'VentureSouq', 'Rashed Abdul Rahman AlRashed & Sons', '500 Global', 'Abunayyan Holding', 'Business Incubators and Accelerators Company(BIAC Incubators)', 'SEEDRA Ventures', 'Saudi Venture Capital Company', 'VentureSouq']",2.0,19.0,54.0,23787.0,10.58,"['Noogata', 'Mind Webs Ventures']"
545431fb-8c10-7fdd-e6be-2efd4048c558,Rackspace,rackspace,"Rackspace provides hybrid cloud-based services that enable businesses to run their workload in a public or private cloud.

Rackspace’s engineers deliver specialized expertise on top of leading technologies developed by OpenStack, Microsoft, VMware, and others through a service known as Fanatical Support. It has more than 300,000 customers worldwide including two-thirds of FORTUNE 100 companies.

Rackspace was named a leader in the 2015 Gartner Magic Quadrant for Cloud-Enabled Managed Hosting and has been honored as one of Fortune’s Best Companies to Work For.

Rackspace was founded in 1998 and is based in San Antonio, Texas.",c_01001_05000,San Antonio,Texas,United States,"['Big Data', 'Cloud Computing', 'Cloud Infrastructure', 'IaaS', 'Information Technology']",1998-01-01,public,sales@rackspace.com,+1-800-961-2888,http://www.linkedin.com/company/rackspace-hosting,http://www.facebook.com/rackspace,http://twitter.com/Rackspace,4.0,292800000.0,"['Just Analytics', 'Bright Skies GmbH', 'Onica', 'Relation Edge', 'Datapipe', 'TriCore Solutions', 'ZeroVM', 'Exceptional Cloud Services', 'Airbrake.io', 'ObjectRocket']","['Platform9', 'Mailgun', 'Cloud Technology Partners', 'CrowdStrike', 'ScaleFT', 'HelpSocial', 'Cloudant', 'DataStax']",1.0,"['ABRY Partners', 'Accel-KKR', 'Sequoia Capital', 'Red Hat', 'Norwest Venture Partners', 'Isom Capital', 'Teton Capital Advisers']",2.0,84.0,113.0,6178995.0,81.56,"['Oracle Dyn', 'ORock Technologies', 'Cedexis', 'Igneous', 'SolidFire', 'Cloudamize', 'Merus Capital', 'Linode', 'MediaKind', 'Cambridge Technology Enterprises']"
6ccf1289-7f33-496b-bc5d-3e875bcc125e,Johns Hopkins Aramco Healthcare,johns-hopkins-aramco-healthcare,"Johns Hopkins Aramco Healthcare provides dental care, emergency care, laboratory, occupational health, pharmacy, primary care, and specialty care services. Their health care organization is designed to drive and enhance the wellbeing of the community in an environment of growth and learning by providing innovative, integrated, and patient-centered care to employees and health care beneficiaries.",c_01001_05000,Dhahran,Ash Sharqiyah,Saudi Arabia,"['Health Care', 'Hospital', 'Medical']",2014-01-01,private,inquiries@jhah.com,+966 13 870 3888,https://www.linkedin.com/company/johns-hopkins-aramco-healthcare-jhah-/,https://www.facebook.com/JHAHNews/,https://twitter.com/jhahnews,,,[],[],,[],,,23.0,297422.0,228.37,"['Alignment Health', 'mfine', 'Bainbridge Health', 'CHRISTUS Health', 'Aspire Health', 'ConvenientMD', 'CallonDoc', 'Washington Gastroenterology', 'St.Clair Hospital', 'Homestead Hospice']"
71213bcb-9569-a838-3d0b-e99ba6afe9cb,Johnson & Johnson,johnson-johnson,"Johnson & Johnson's research and development, manufacturing, and sale of healthcare products include pharmaceuticals, medical devices, and diagnostics. The company aims to improve access and create healthier communities.",c_10001_max,New Brunswick,New Jersey,United States,"['Health Care', 'Medical Device', 'Personal Care and Hygiene', 'Pharmaceutical']",1886-01-01,public,,+1 732 524 0400,https://www.linkedin.com/company/johnson-&-johnson,https://www.facebook.com/jnj,https://www.twitter.com/jnjnews,,,"['Yellow Jersey Therapeutics', 'Proteologix', 'Serotiny', 'Ambrx', 'Abiomed', 'Momenta Pharmaceuticals', 'TARIS Biomedical', 'Verb Surgical', 'Auris Health', 'Ci:z Holdings']","['SwipeRx', 'IndyGeneUS AI', 'Lucia Health Guidelines', 'knowRX', 'TQIntelligence', 'Radical Health', 'Ayana Therapy', 'Patient Orator', 'M-SCAN', 'Uganics']",10.0,[],,43.0,51.0,2321862.0,9.86,"['National Institutes of Health', 'Colgate Palmolive', 'Organon', 'Fresenius Medical Care', 'Abbott', 'Purdue Pharma', 'Johnson & Johnson', 'Aspen Pharmacare', 'B. Braun Medical', 'Siegfried Rhein']"
b7dfc476-1ab9-e897-13f1-8a3781057ad1,Masterworks,masterworks,Masterworks is a full-service agency helping Christian non-profits accomplish more.,c_00101_00250,Poulsbo,Washington,United States,"['Advertising', 'Marketing']",1989-01-01,private,info@masterworks.com,1(360)394-4300,https://www.linkedin.com/company/masterworks/,https://www.facebook.com/masterworks/,https://twitter.com/masterworks,,,[],[],,[],,,61.0,,,"['SilverTech Inc.', 'Woden', 'Agency EA', 'Lussier', 'Miller Advertising Agency', 'Rocksteady Promotions', 'Redmond Design', 'Woodbury & Morse']"
f809fcb0-52f8-5590-2e02-59251ca3a8d4,OTIS,otis,"Otis is a manufacturer, installer, and maintainer of elevators, escalators, and moving walkways - a constant, reliable name for more than 150 years. They are dedicated to connect people and places that matter.",c_10001_max,Farmington,Connecticut,United States,"['Building Maintenance', 'Commercial', 'Industrial', 'Machinery Manufacturing', 'Manufacturing', 'Transportation']",1853-01-01,public,hq.customerinquiries@otis.com,34 91 343 51 00,https://www.linkedin.com/company/otis_elevators,https://www.facebook.com/mosotis,https://twitter.com/OtisElevatorCo,,,[],[],,[],,31.0,121.0,322610.0,-18.88,"['GE Aviation', 'Polaris Industries', 'Tnemec', 'TPI Composites', 'Gardner Denver', 'WrightBus', 'Uponor', 'Austin Engineering Limited', 'DNV GL', 'VMAC Global Technology']"
e83b8f68-8bc9-6b56-220c-0ffbd470b931,Dell,dell,Dell transforms computing and provides high-quality solutions for people and businesses to be ready to move forward. Its customers and team members are integral to its continuing success as it provides the essential infrastructure for organizations to transform their digital futures.,c_10001_max,Round Rock,Texas,United States,"['Computer', 'Consumer Electronics', 'Hardware', 'Information Technology']",1984-01-01,public,,(201)528-5501,https://www.linkedin.com/company/delltechnologies,https://www.facebook.com/Dell,http://www.twitter.com/Dell,,,"['Moogsoft', 'Cloudify', 'Dell EMC', 'StatSoft', 'Kitenga', 'CREDANT Technologies', 'Gale Technologies', 'Quest Software', 'SonicWALL', 'Make Technologies']","['FogHorn', 'Fusion-io', 'NextIO', '2Wire', 'SiRF Technology', 'Sanctum', 'SmartPipes', 'VMware', 'Ubicom', '2nd Century']",8.0,[],,131.0,134.0,64988019.0,3.21,"['HP', 'Ayar Labs', 'neXus', 'McAfee', 'Acer', 'HTC', 'Forget Computers', 'S&T', 'OSI Hardware', 'Sehi Computer Products']"
a6f8e0d8-9f8e-1ee9-5dce-b312304782e2,Cartier,cartier,"Cartier designs, manufactures, distributes, and sells jewelries, watches, perfumes, and accessories. It develops a wide range of luxury collections of jewelries, watches, leather goods, fragrances, and accessories. From the Trinity ring to the Love bracelet, the Santos de Cartier to the Tank watches, the Panther ring to the Caresse d'Orchidées par Cartier brooch; Cartier is the reference for its design and savoir-faire and it recognizes as a pioneer for its creations, icons of rarity, styles, and craftsmanship. The services of the company are online purchases, client services, and expertise guides.

Cartier is a France-based company that was founded in 1847.",c_05001_10000,Paris,Ile-de-France,France,"['Jewelry', 'Manufacturing', 'Retail']",1847-01-01,private,,+33 0 17 3219 502,http://www.linkedin.com/company/cartier,http://www.facebook.com/Cartier,http://twitter.com/cartier,,,[],[],,[],,70.0,82.0,,,"['KGK Group', 'Pandora A/S', 'EMOTIVA AUDIO', 'Jaeger-LeCoultre', 'Givenchy SA', 'Birks & Mayors', 'Kompan A/S', 'Patek', 'Harry Winston, Inc.', 'Tissot']"
7287b03f-94ca-4482-83b4-80791f4f72b6,Mozn,mozn,"Mozn is the market leader in building and deploying bespoke AI solutions in the region, and developing Arabic NLP data products globally.",c_00501_01000,Riyadh,Ar Riyad,Saudi Arabia,"['Analytics', 'Artificial Intelligence (AI)', 'Big Data', 'Business Intelligence', 'Machine Learning']",2017-01-01,private,info@mozn.ai,+966 11 203 0334,https://www.linkedin.com/company/mozn/,,https://www.twitter.com/Mozn_ai,1.0,10000000.0,[],[],,"['Global Founders Capital', 'Shorooq Partners', 'Sukna Ventures', 'VentureSouq', 'Raed Ventures']",1.0,,17.0,,,"['Unsupervised', 'Atlas AI', 'Quarrio', 'Gongye Technology', 'Granify', 'Nervana']"
