Company ID,Company Name,Name from URL,Description,Company Size,City,State,Country,Business Category,Founded at (Date),IPO status,E-mail,Phone:,Linkedin,Facebook,Twitter,Funding Rounds,Funding Total (USD),Acquisitions,Investments,Lead Investments,Investors,Lead Investors,Total Products Active,Active Tech Count,Monthly Visits,Monthly Visits Change(%),Similar Companies
da43571b-483f-46e7-9a61-e7fb4f18cf77,Deqode,deqode,"At Deqode, our purpose is to help businesses solve complex problems using new-age technologies. We are industry leaders in blockchain solutions and we leverage our deep industry knowledge and technical expertise to optimise business processes, maximize impact and foster business growth. We are driven by our passion to innovate and create solutions that inspire the future. We also provide services in Web/App Development, Cloud Services, DevOps solutions and services, Blockchain, Business Process Management
Team as a Service, and product development services by Deqode Labs.",c_00251_00500,Indore,Madhya Pradesh,India,"['Blockchain', 'Cloud Computing', 'DevOps', 'Enterprise Software', 'Ethereum', 'Information Technology', 'Mobile', 'Smart Contracts', 'Staffing Agency', 'Web Development']",2016-01-01,private,marketing@deqode.com,91 731 407 7574,https://www.linkedin.com/company/deqodesolutions/,https://www.facebook.com/deqodesolutions/,https://twitter.com/deqodesolutions,,,[],[],,[],,,12.0,1714.0,81.76,"['CricHQ', 'ApprenNet', 'Cloudnexa', 'Seasia Infotech', 'Moveo Group', 'Binmile', 'PromptWorks', 'Hivelance Technologies']"
f588c50f-8059-423c-92be-ee068a916356,Tech Talent,tech-talent,Tech Talent is a consulting company that provides professional training and coaching services.,c_00001_00010,Brasil,Sao Paulo,Brazil,"['Consulting', 'Information Technology', 'Training']",,private,,,https://www.linkedin.com/company/techtalentbr/,https://www.facebook.com/techtalentbr/,,1.0,,[],[],,['Google for Startups'],1.0,,,,,"['Innovia', 'The Sales Rebellion', 'Santinel', 'Hicare Research', 'Harold S Haller & Company', 'AI Darwin', 'RP One', 'FUTUREPLAN', 'Pomtech International', 'The Diversity Institute']"
8a6c7a48-1054-403c-99ea-e4ce8a70764b,TechTalent,techtalent,"TechTalent is a training center that provides courses, deployment, and recruitment services for business development.",c_00051_00100,London,England,United Kingdom,"['Business Development', 'Consulting', 'Training']",2019-01-01,private,contact@techtalent.co.uk,,https://www.linkedin.com/company/techtalent-academy/,https://www.facebook.com/TechTalentAcademy/,https://twitter.com/TechTalentAcad,,,[],[],,[],,,21.0,75.0,-11.76,"['Integris Performance Advisors', 'Agentix', 'PCE', 'CI Projects', 'CQM Training & Consultancy', 'Praesta', 'Dancing Lion', 'Senkroncoach', 'IdeaBoosterLab', 'humancraft']"
e4c4b4c0-3c0f-2b38-38f6-dd7809a0b9fe,ArabyAds,arabyads,"ArabyAds is the owner of a performance marketing firm which goal is to strengthen e-commerce marketing.

The company provides a variety of marketing platforms and services, including lead generation, sales promotion, customer acquisition, market testing, internet marketing, product display, and others.

ArabyAds was established in 2013 by Mohammad Khartabil in Cairo, Al Qahirah.",c_00251_00500,Cairo,Al Qahirah,Egypt,"['Advertising', 'E-Commerce', 'Marketing', 'Mobile Advertising']",2013-01-01,private,info@arabyads.com,+2 012 003 52103,https://www.linkedin.com/company/9470079,https://www.facebook.com/arabyads,https://twitter.com/arabyads,2.0,36500000.0,"['indaHash (IDH Media Ltd.)', 'Dmenta', 'AdFalcon']",['AIfluence'],,"['AfricInvest', 'EQ2 Ventures']",2.0,30.0,28.0,2047.0,-41.81,"['Jiji', 'Fyber - A Digital Turbine Company', 'ADA', 'iAdvize', 'Bitauto Holdings', 'engage:BDR', 'RevX', 'SourceKnowledge', 'Adcade', 'UberMedia']"
feb4ca0e-1661-48c0-ba15-0888819cc9e3,Saudi Azm,saudi-azm,"Saudi Azm is a company that specializes in the innovation, implementation &  management of unique services. They are experts in information technology, service engineering, and executive consulting. It provides creative solutions for projects with a qualitative impact, in specialized information technology, executive consultancy, and financial technology projects. The company aspires to be the preferred partner for its clients in providing information technology services and executive consultancy.",c_00051_00100,Riyadh,Ar Riyad,Saudi Arabia,"['Consulting', 'Email', 'Human Resources', 'Information Technology', 'Software']",2017-01-01,private,info@azm.sa,+966 11 288 4141,https://www.linkedin.com/company/saudi-azm/,,https://twitter.com/saudiazim,,,[],[],,[],,15.0,31.0,7982.0,228.48,"['OutSail', 'Gulf HR', 'OS3 Infotech', 'Prime Time', 'Talpedia', 'Pupilar', 'CDC Information System']"
db95d288-f0d2-e5e7-14ab-158e6b4bf706,Dataiku,dataiku,"Dataiku is a centralized data platform that moves businesses along their data journey from analytics at scale to enterprise AI. By providing a common ground for data experts and explorers, a repository of best practices, shortcuts to machine learning and AI deployment/management, and a centralized, controlled environment, Dataiku serves as a catalyst for data-powered companies.

Customers like Unilever, GE, and FOX News Group use Dataiku to ensure they are moving quickly and growing exponentially along with the amount of data they’re collecting. By removing roadblocks, Dataiku ensures more opportunities for business-impacting models and creative solutions, allowing teams to work faster and smarter.",c_01001_05000,Paris,Ile-de-France,France,"['Analytics', 'Artificial Intelligence (AI)', 'Big Data', 'Data Integration', 'Enterprise Software']",2013-01-01,private,contact@dataiku.com,646-568-7477,http://www.linkedin.com/company/dataiku,http://www.facebook.com/dataiku,http://twitter.com/dataiku,11.0,846835229.0,[],[],,"['Wellington Management', 'Olivier Pomel', 'Eurazeo', 'Insight Partners', 'Insight Partners', 'Lightrock', 'Snowflake Ventures', 'ICONIQ Growth', 'Battery Ventures', 'Eurazeo']",12.0,46.0,71.0,559358.0,44.62,"['Pieces', 'ContextLabs', 'Digital Reasoning', 'Prospection', 'TAIGER', 'Bentego Teknoloji', 'Lyon Data Science']"
bc615f7e-ba1d-1870-60a5-54f14a181b77,Rise,rise,"Rise provides affordable 1:1 personal diet coaching from top nutrition experts. Their unique mobile platform connects you with an expert nutrition coach that understands your personal tastes and lifestyle, and holds you accountable until you achieve your goals.  And through smart design and efficiency leaps, they’re able to provide this service for as low as $1 per day.",c_00011_00050,San Francisco,California,United States,"['Health Care', 'Mobile', 'Nutrition', 'Personal Health']",2013-01-01,private,team@rise.us,,https://www.linkedin.com/company/-rise/,http://www.facebook.com/riselabs,http://twitter.com/rise,2.0,3100000.0,['HealthyOut'],[],,"['Lightbank', 'Cowboy Ventures', 'Google Ventures', 'Shervin Pishevar', 'Maveron', 'Floodgate', 'Great Oaks Venture Capital', 'Ellen Levy', 'ACME Capital', 'Greylock']",1.0,28.0,10.0,,,"['NGX', 'YgEia3', 'AVA', 'Habit Food Personalized', 'PlateJoy', 'Mango Health', 'Kalorist', 'Drlam.com', 'Iceboxe']"
